username;date;retweets;favorites;text;geo;mentions;hashtags;id;permalink
;2017/12/25 08:39;5;6;"Smart transport #startups selected for new Intelligent Mobility Accelerator https://ts.catapult.org.uk/news-events-gallery/news/smart-transport-start-ups-selected-new-intelligent-mobility-accelerator/ … #autonomous #smartcity #ai #Iot #robot #tech #5g #driverless #selfdriving #mobility #automotive #startup #future #auto #uk #transport #SmartNewspic.twitter.com/Tl97FWyqnf";;;#startups #autonomous #smartcity #ai #Iot #robot #tech #5g #driverless #selfdriving #mobility #automotive #startup #future #auto #uk #transport #SmartNewspic;"945212465771663360";https://twitter.com/guidaautonoma/status/945212465771663360
;2017/12/12 08:17;7;23;"I bet we have one of the best @Paystack Integrations at @GigaLayer. Here's why... — Intelligent country & currency detection to bill in USD / NG. — Previous card remembering & auto removal of expired cards. — One click pay with existing card. — Airtime rewards for all payments. pic.twitter.com/YCJBouNwK2";;@Paystack @GigaLayer;;"940495840396894208";https://twitter.com/mukoshy/status/940495840396894208
;2017/12/05 10:05;2;5;"Tencent and Guangzhou Auto reveals the iSPACE concept car and the intelligent network for… https://evobsession.com/tencent-and-guangzhou-auto-reveals-the-ispace-concept-car-and-the-intelligent-network-for-cars/ …pic.twitter.com/ATNlYu4l8d";;;;"937986276531343360";https://twitter.com/zshahan3/status/937986276531343360
;2017/11/30 03:40;10;4;"RIP WEH ! Reasons to stall traffic in mumbai: Bad rd, Shaadi ki Baraat, Religious ceremonies,Poor auto drivers, intelligent car drivers, bicycles chain mishap,hawkers,illegal parking, efficient police n many more to list dwn. @SrBachchan @mumbaitraffic @Dev_Fadnavis @MumbaiPolice";;@SrBachchan @mumbaitraffic @Dev_Fadnavis @MumbaiPolice;;"936077395513225217";https://twitter.com/GhantawalaBaBa/status/936077395513225217
;2017/11/10 18:38;3;13;"@NimbatusGame #nimbatusgame Presenting the monster... the destruction from the depths... APOFIS THE CHAOS MASTER. Features: -6 Bio-spark self-rotating turrets -6 Auto lasers -9 Front lasers -Intelligent auto movement system (to move and hover) -1 cool "eye" in the middle xD pic.twitter.com/2nf4Ots7HS";;@NimbatusGame;#nimbatusgame;"929055725921370112";https://twitter.com/rodroelmelon/status/929055725921370112
;2017/10/02 20:43;24;55;"Safety measures could reduce gun deaths. The best example of intelligent regulation is auto safety. http://nyti.ms/2fECOp9 pic.twitter.com/x175440BPB";;;;"914938921414426625";https://twitter.com/nytopinion/status/914938921414426625
;2017/09/12 11:18;11;95;"Our intelligent photography helps you capture great shots by auto-selecting settings based on object and scene recognition. #HuaweiMobileAIpic.twitter.com/7WlQJjISEp";;;#HuaweiMobileAIpic;"907549025800507392";https://twitter.com/HuaweiMobile/status/907549025800507392
;2017/07/19 23:05;29;16;"More details on Auto Plan Correction in #sqlserver2017. Check out intelligent diagnostics built into SQL Server http://bit.ly/2uKy1vU ";;;#sqlserver2017;"887795440833265665";https://twitter.com/bobwardms/status/887795440833265665
;2017/06/23 12:44;5;6;"The tallying system is intelligent to know the no of voters per polling station and any attempt to inflate the figures is auto rejected";;;;"878217128905764864";https://twitter.com/Mwolooto/status/878217128905764864
;2017/06/16 22:42;7;14;"Comparisons between auto safety and digital security must die, unless your defensive driving model addresses intelligent armed adversaries.";;;;"875831046482407424";https://twitter.com/taosecurity/status/875831046482407424
;2017/06/05 21:41;124;220;"Safari 11 is huge. WebRTC, WebAssembly, Intelligent Tracking Prevention, Auto-Play blocking, and more. https://developer.apple.com/library/content/releasenotes/General/WhatsNewInSafari/Safari_11_0/Safari_11_0.html …";;;;"871829286096785408";https://twitter.com/rmondello/status/871829286096785408
;2017/06/05 18:33;2;5;"#Safari now with auto play blocking and intelligent tracking prevention to protect your privacy while browsing #WWDC2017pic.twitter.com/JfWS3KqAsN";;;#Safari #WWDC2017pic;"871782144883949568";https://twitter.com/compub/status/871782144883949568
;2017/06/05 18:31;65;74;"New for Safari: auto play blocking, intelligent tracking prevention https://9to5mac.com/2017/06/05/wwdc-2017-apple-announces-ios-11-macos-10-13-siri-speaker-new-ipad-pro-more/ …pic.twitter.com/60JoKbENlr";;;;"871781636374802432";https://twitter.com/9to5mac/status/871781636374802432
;2017/05/08 23:37;2;16;"Auto correct is supposed help you appear to be more intelligent yet 99% of the time it makes you sound like a ducking buffoon. #irony";;;#irony;"861711769210941440";https://twitter.com/ericispbic/status/861711769210941440
;2017/04/20 08:37;34;102;"It could redefine the auto world! Intelligent driving highlighted at Shanghai exhibition pic.twitter.com/HAu5YPTk9i";;;;"854962167485018112";https://twitter.com/XHNews/status/854962167485018112
;2017/04/19 07:45;3;11;"Does your connected car care about you? A personal case for more emotionally intelligent auto experiences http://us2.co/2pP79Ve  pic.twitter.com/TGGhG4mvSO";;;;"854586686793285632";https://twitter.com/ustwo/status/854586686793285632
;2017/04/17 10:46;177;780;"On Wednesday, April 19, #Nissan will present its vision of a more intelligent driving future at Auto Shanghai 2017: https://newsroom.nissan-global.com/releases/release-42c2f017f53f247401d0ce3c6c005038-170329-04-e …pic.twitter.com/1PPpCUZgzV";;;#Nissan;"853907463254319104";https://twitter.com/NissanMotor/status/853907463254319104
;2017/04/04 06:09;2;7;"#Nissan Intelligent Mobility to be showcased at Auto Shanghai 2017. Read more here: http://bit.ly/2nyANfM  #NissanIntelligentMobilitypic.twitter.com/lHUQWkaskg";;;#Nissan #NissanIntelligentMobilitypic;"849126861602816000";https://twitter.com/Nissan_Aus/status/849126861602816000
;2017/03/19 14:30;7;26;"Designed with an intelligent technology of Auto Gear Shift, #Ignis brings to you a smooth & comfortable driving experience.pic.twitter.com/20S9VZM0mQ";;;#Ignis;"843469646628098048";https://twitter.com/NexaExperience/status/843469646628098048
;2017/02/24 12:49;3;8;"Great tour! @UWaterloo Green & Intelligent Auto lab w/Ross McKenzie. Good prospects 4 Cda-Jpn R&D in #ITS & #greenvehicles! #carsonthebrainpic.twitter.com/zguT8FgPhY";;@UWaterloo;#ITS #greenvehicles #carsonthebrainpic;"835109293263237120";https://twitter.com/IanBurneyJapan/status/835109293263237120
;2017/01/27 18:43;10;38;"YouTube v12.03 hints at intelligent auto-download for offline viewing, Picture-in-Picture support for Android TV,… http://www.androidpolice.com/2017/01/27/youtube-v12-03-hints-at-intelligent-auto-download-for-offline-viewing-picture-in-picture-support-for-android-tv-and-viewer-polls-apk-teardown/ …pic.twitter.com/ecsrXnfIF9";;;;"825051554789011456";https://twitter.com/AndroidPolice/status/825051554789011456
;2017/01/23 22:30;1;2;"Images solved! Auto intelligent content-aware cropping & encoding, dynamic formats & automatic responsive images http://snip.ly/alvrq pic.twitter.com/2eJ6FxTmdo";;;;"823659299993952259";https://twitter.com/cloudinary/status/823659299993952259
;2017/01/23 20:56;4;3;"Intelligent auto-completion for PromQL queries? Jupyter-esque Prometheus notebooks? Oh yes! @weaveworks @PrometheusIOhttps://twitter.com/PrometheusIO/status/823634449388675072 …";;@weaveworks @PrometheusIOhttps;;"823635654458437632";https://twitter.com/tom_wilkie/status/823635654458437632
;2017/01/23 18:06;0;4;"Writing up an #SPSSTL trip report for my team (using team news feature), & glad it auto-saves; mobile & intelligent & #gotyourback intranet!";;;#SPSSTL #gotyourback;"823592872888791040";https://twitter.com/mkashman/status/823592872888791040
;2017/01/19 20:15;0;3;"The technically advanced Corvus Auto 100 has intelligent indicators & an infra-red sensor for hands-free use! http://bit.ly/2iga4qJ pic.twitter.com/kMyk7o8KFZ";;;;"822175682784620544";https://twitter.com/vango/status/822175682784620544
;2017/01/19 06:40;1;2;"Autopilot for #Tesla HW2 vehicles rolling out now including auto-steer & intelligent speed maintenance #selfdrivinghttp://tcrn.ch/2jWOEiP ";;;#Tesla #selfdrivinghttp;"821970584859013120";https://twitter.com/itsyourenergy/status/821970584859013120
;2017/01/13 18:25;0;4;"At last couple #AHIPinstitute s saw very cool auto-authorization tech, based on intelligent workflow engines, very cool! #AskAvailityhttps://twitter.com/csjohnson123/status/819973236343664640 …";;;#AHIPinstitute #AskAvailityhttps;"819973742432489473";https://twitter.com/wareFLO/status/819973742432489473
;2017/01/12 07:00;3;1;"Aricent's #V2X solution enables operators, auto #OEM developers to jump into intelligent transportation systems http://bit.ly/2hYvJlr  #IoT";;;#V2X #OEM #IoT;"819438950918062080";https://twitter.com/Altran_NA/status/819438950918062080
;2017/01/06 04:34;11;11;"New Toyota Intelligent car advises tired driver to switch to auto drive mode https://japaneseclass.jp/matome/39 ";;;;"817227726385860609";https://twitter.com/jcjp/status/817227726385860609
;2017/01/05 05:55;2;3;"#Airwheel F3 #Smart #drones , Exquisite "intelligent" Shooting. Auto aerial photography drones. #CES2017 #CES2017pic.twitter.com/Z6UFGn0HOr";;;#Airwheel #Smart #drones #CES2017 #CES2017pic;"816885895072620544";https://twitter.com/AirwheelCZ/status/816885895072620544
;2017/01/03 21:29;0;6;"Hey auto body guy, better luck next time trying to upcharge this hangry, intelligent, feminist #boybye";;;#boybye;"816396176236879872";https://twitter.com/gynandtonicMD/status/816396176236879872
;2016/12/26 16:00;0;5;"Use intelligent playlists in Rekordbox to auto-sort playlists by Camelot key (use track titles that contain key)";;;;"813414107344932864";https://twitter.com/MPQuickTips/status/813414107344932864
;2016/12/23 04:16;1;4;"Idiots enjoying on public money & honest Intelligent Ppls are in Que & many selling Vegetables or Driving Auto @sureshpprabhu Ji Do needful";;@sureshpprabhu;;"812149929778900992";https://twitter.com/Gravim71/status/812149929778900992
;2016/12/20 06:24;0;6;"1. Clear Team. 2. Intelligent Auto-Fill…. :) (don’t mind me)";;;;"811095015808114688";https://twitter.com/petejank/status/811095015808114688
;2016/12/08 11:23;0;4;"Have you guys seen JUNO on @kickstarter? It’s an intelligent makeup mirror with auto light sensing technology! https://www.kickstarter.com/projects/1414316885/juno-the-smartest-makeup-mirror-ever …pic.twitter.com/rpjGtYGzhy";;@kickstarter;;"806821509574561792";https://twitter.com/awkwardpurse/status/806821509574561792
;2016/11/26 19:14;0;3;"Really enjoying the auto focus on this camera Incredibly fast and intelligent once you get… http://bit.ly/2gxqJSA pic.twitter.com/HV7Iem6IZg";;;;"802591364781326340";https://twitter.com/inel/status/802591364781326340
;2016/11/17 22:20;20;26;"Check out these crazy seats with a mind of their own: Land Rover's new intelligent seats at the L.A. Auto Show?. http://usat.ly/2fxbcn0 pic.twitter.com/Ah2sOsjb7g";;;;"799376661363900417";https://twitter.com/USATODAYmoney/status/799376661363900417
;2016/11/17 17:32;5;3;"Auto-correct and spellcheck getting real intelligent. Typed "married" and auto-corrected to "martyred".";;;;"799304302200311812";https://twitter.com/drbabarkhan/status/799304302200311812
;2016/11/17 01:20;4;2;"Auto tweets, which kidnap artists names and claim their opinions, are acts of desperate liars. Artists need intelligent agents.";;;;"799059509268205568";https://twitter.com/VondaNorwood/status/799059509268205568
;2016/11/16 21:09;1;2;""Beam me up, Scotty! There is no intelligent life on this planet!" Hatte ich 1989 auf meinem Auto. #truestory";;;#truestory;"798996403934535680";https://twitter.com/Rainer42/status/798996403934535680
;2016/11/08 15:04;1;3;"#Tableau #Data16 intelligent auto clustering pic.twitter.com/deiFCRL43h";;;#Tableau #Data16;"796005441016922113";https://twitter.com/idigdata/status/796005441016922113
;2016/11/02 15:39;2;7;"nRF51824 - Bluetooth for intelligent vehicles. Now qualified to auto grade 2: -40°C to +105°C! Read more: https://www.nordicsemi.com/eng/Products/Bluetooth-low-energy/nRF51824 …pic.twitter.com/aNrtYwBsj0";;;;"793839838554271744";https://twitter.com/NordicTweets/status/793839838554271744
;2016/10/17 20:38;5;7;"Discussing intelligent #transportation systems and advanced vehicles with @MarcGarneau and the #Auto Caucus. #cdninnovationpic.twitter.com/16QDhBDUGR – At Parliament of Canada - Centre Block";;@MarcGarneau;#transportation #Auto #cdninnovationpic;"788101822007369729";https://twitter.com/JohnOliverMP/status/788101822007369729
;2016/10/07 16:44;2;2;"Thirdspace Auto create intelligent applications for automobiles that enable passengers to do more #DSrupt finalist http://ow.ly/l8rU304Iv20 ";;;#DSrupt;"784419183501119488";https://twitter.com/TFSUK/status/784419183501119488
;2016/09/23 00:25;1;17;"my phone auto corrected al dente and made me look real intelligent";;;;"779099206720028673";https://twitter.com/phoenixwuff/status/779099206720028673
;2016/09/14 13:00;20;31;"Interested in auto bots, real-time #IoT solutions, and intelligent apps? Start building: http://spr.ly/6011BAglT  #AIpic.twitter.com/VqWj7LfRwn";;;#IoT #AIpic;"776027734183215104";https://twitter.com/MSFTImagine/status/776027734183215104
;2016/08/30 16:00;2;4;"#TechReview: The Intelligent Spell Checker- Global Auto Correct http://ow.ly/gnLY303IPub  @LexAbleSoftware #dyslexia #dyslexic";;@LexAbleSoftware;#TechReview #dyslexia #dyslexic;"770637348900143104";https://twitter.com/TheCodpast/status/770637348900143104
;2016/08/20 12:14;5;2;"For those in/near NW10, can recommend Willesden Auto Service Centre in Goodson Rd. Intelligent, inexpensive, honest, quick #Harlesden #car";;;#Harlesden #car;"766956500912791552";https://twitter.com/LIS4G33/status/766956500912791552
;2016/08/04 19:00;3;5;"The artificially intelligent auto-following Staaker drone is just a little bit OMG - http://trib.al/2WGWkay pic.twitter.com/DV7xe19KMz";;;;"761260522826235904";https://twitter.com/mbrmagazine/status/761260522826235904
;2016/07/23 06:30;2;7;"The @DucatiMotor #Multistrada1200S is one intelligent mororbike, says @aceperkinsmag. #allaboutluxury #auto pic.twitter.com/kzRcCmoRMJ";;@DucatiMotor @aceperkinsmag;#Multistrada1200S #allaboutluxury #auto;"756723140894523392";https://twitter.com/aceperkinsmag/status/756723140894523392
;2016/07/17 12:51;27;11;"#China establishes auto #cybersecurity committee for intelligent connected cars #IoT http://www.china.org.cn/business/2016-07/16/content_38897014.htm … pic.twitter.com/cUsHg3nUgD";;;#China #cybersecurity #IoT;"754644578423152640";https://twitter.com/ptrancyber/status/754644578423152640
;2016/07/07 19:19;3;7;"Intelligent Dispatch: Our new tech will operate 24/7 to auto respond to same-day delivery requests within seconds. http://hubs.ly/H03ywl50 ";;;;"751118425729167360";https://twitter.com/Dropoff/status/751118425729167360
;2016/06/06 22:35;3;4;"#Harris CapRock One; the most intelligent, auto-switching, managed comms service. Learn more at #APPEA2016 booth 271pic.twitter.com/8DKreFwuOF";;;#Harris #APPEA2016;"739933714025680896";https://twitter.com/L3HarrisTech/status/739933714025680896
;2016/05/23 16:00;26;21;". @BMW's #Azure-powered intelligent personal travel assistant is transforming auto industry w/ latest #IoT tech: http://msft.it/6013BUt7z ";;@BMW;#Azure #IoT;"734760828981874688";https://twitter.com/MicrosoftIoT/status/734760828981874688
;2016/05/22 11:04;5;16;"AUTO CONFESSIONS : ANDERS DANIELSEN LIE: “ #KristenStewart IS A VERY INTELLIGENT WOMAN” http://festival-de-cannes.parismatch.com/Auto-Confidences/Anders-Danielsen-Lie-Je-ne-suis-pas-a-l-aise-sur-les-tapis-rouge-Comme-Kristen-Stewart-973459 …pic.twitter.com/ifiCJqK9z7";;;#KristenStewart;"734324083773431808";https://twitter.com/KSTEWART_THAI/status/734324083773431808
;2016/05/17 17:10;2;6;"Intelligent Sequencing = #cognitive capability that will auto resequence products to optimize your site #IBMAmplifypic.twitter.com/Ez8Cxnrna0";;;#cognitive #IBMAmplifypic;"732604278972526592";https://twitter.com/MariaWinans/status/732604278972526592
;2016/04/29 17:51;2;2;"Nissan convenes Intelligent Motoring Advisory Board with future of mobility vision http://cornwallnissan.ca/news/Nissan+convenes+Intelligent+Motoring+Advisory+Board+as+it+powers+ahead+with+future+of+mobility+vision+7C+Nissan+rC3A9unit+un+ComitC3A9+de+Conseil+sur+lE28099Automobile+Intelligente+dans+le+cadre+de+son+engagement+dans+l27avenir+de+la+mobilitC3A9/6338/ … #Nissan #Mobility #Auto #SNRTG";;;#Nissan #Mobility #Auto #SNRTG;"726091616541351938";https://twitter.com/CornwallNissan/status/726091616541351938
;2016/04/27 20:22;2;2;"Nissan at Auto China 2016: Full Press Conference - Introducing Nissan Intelligent Driving with Piloted Drive:... http://fb.me/4GHBgzsHF ";;;;"725404651097485313";https://twitter.com/CornwallNissan/status/725404651097485313
;2016/04/19 10:25;7;3;"Intelligent auto-detection of social in #msdyncrm create rules to reduce work & complexity #eXtremeCRM pic.twitter.com/QBVZv7KqYy @rikdubbink";;@rikdubbink;#msdyncrm #eXtremeCRM;"722355428621991936";https://twitter.com/martintenvoorde/status/722355428621991936
;2016/04/05 05:28;4;5;"7 Port 45W USB Desktop High Speed Charging Station with Intelligent Auto Detect Technology.… https://www.instagram.com/p/BDzh9kBGyCe/ ";;;;"717207251228995585";https://twitter.com/Adriansrevgrp/status/717207251228995585
;2016/03/15 16:26;1;5;"Auto-correct often makes intelligent people appear illiterate.";;;;"709777695664578561";https://twitter.com/Brian_Sussman/status/709777695664578561
;2016/03/07 20:15;4;16;"*backspaces word and retypes instead of letting auto correct fix it for me* i don't need no man!!! am a fierce & intelligent black WOMAN!!!";;;;"706936260070391808";https://twitter.com/nicolemilfie/status/706936260070391808
;2016/03/06 14:45;1;3;"High demand of sensors in intelligent #iiot, #Auto and #consumer systems will greatly impact the growth of #iot market. #BigData, #M2M";;;#iiot #Auto #consumer #iot #BigData #M2M;"706490974906806272";https://twitter.com/Nevosys/status/706490974906806272
;2016/03/04 03:56;0;2;"@Patbacon__ my 4.0++son @I_AmRichard reminded me of my auto-correct mistake. No one has ever worked harder.. intelligent azz MF.";;@Patbacon__ @I_AmRichard;;"705602847333859328";https://twitter.com/indyblueaau/status/705602847333859328
;2016/02/24 08:54;2;2;"@atherenergy 's #intelligent #electric #scooter brings #gamification & #analytics for customers http://gadgets.ndtv.com/others/features/this-bengaluru-startup-is-ready-to-disrupt-the-auto-industry-with-gamification-805536 … #auto #cars #IoT";;@atherenergy;#intelligent #electric #scooter #gamification #analytics #auto #cars #IoT;"702416184554221568";https://twitter.com/manishk_mar/status/702416184554221568
;2016/02/19 17:59;0;2;"I'm reading the auto biography of Malcom X rn for self enlightenment and he was such an intelligent man";;;;"700741487529750528";https://twitter.com/AmeliaDiomi_/status/700741487529750528
;2016/02/19 07:46;1;2;"If you wanna have intelligent convos about auto mechanics, you need to educate yourself about intersectionall... https://twitter.com/RAShieldsor/status/700581544583258112 …";;;;"700587326280376321";https://twitter.com/Dark_Star_Ent/status/700587326280376321
;2016/02/16 22:46;0;2;"There are some pretty good, mostly intelligent tweets out there. I'd love to RT some of them, but the F-bomb is an auto no-RT. Sorry.";;;;"699726569711865856";https://twitter.com/Solameanie/status/699726569711865856
;2016/02/16 21:51;0;1;"How auto dealerships implement intelligent floor sensors http://hubs.ly/H0269vJ0  #retail #InternetofThings #BigDatapic.twitter.com/4Z0EqCU5mS";;;#retail #InternetofThings #BigDatapic;"699712623768702977";https://twitter.com/ScanalyticsInc/status/699712623768702977
;2016/02/04 05:17;0;1;"@codypriebe @lamlux @DGDCphotos Camera: "Incompetent photographer detected: selecting Intelligent Auto mode."";;@codypriebe @lamlux @DGDCphotos;;"695113907728297985";https://twitter.com/ZDP189/status/695113907728297985
;2016/01/31 16:33;0;8;"@chelseadae I just put skin soften on low and shoot on intelligent auto!";;@chelseadae;;"693834441807040512";https://twitter.com/SsssamanthaaMUA/status/693834441807040512
;2016/01/31 03:30;0;3;"Wise.io Launches Intelligent Auto Reply Capability to Enhance Efficiency and Productivity of Customer Support... http://www.martechadvisor.com/news/wiseio-launches-intelligent-auto-reply-capability-to-enhance-efficiency-and-productivity-of-customer-support-agencies/ …";;;;"693637368843120641";https://twitter.com/chatbotfriends/status/693637368843120641
;2016/01/26 03:38;1;10;"@BioLayne @sarahbowmar__ @AnthonyOct25 she must have an auto blocker program that blocks all intelligent life...lol";;@BioLayne @sarahbowmar__ @AnthonyOct25;;"691827467447836674";https://twitter.com/jeffashep/status/691827467447836674
;2016/01/02 19:06;2;3;"Photive 50 Watt 6 Port USB Desktop Rapid Charger. Intelligent USB Charger with Auto Detect http://bit.ly/1YWINZd  pic.twitter.com/NYDJuRUQ3T";;;;"683363783591505920";https://twitter.com/TheInStockRoom/status/683363783591505920
;2015/12/10 16:19;12;16;"QNX & @AdasWorks collaborate on automated driving tech http://www.qnx.com/news/pr_6288_1.html …. Enabling intelligent, multi-camera surround-view systems.";;@AdasWorks;;"674986865888501760";https://twitter.com/QNX_Auto/status/674986865888501760
;2015/11/17 01:18;4;2;"Ha! My smart phone more intelligent than dem voters, everytime I type Potus it auto corrects POS! :)";;;;"666425222812344320";https://twitter.com/RRRoxy/status/666425222812344320
;2015/11/15 23:54;0;2;"@ughesq @LadyLegalWriter Can't stop laughing because Google inbox auto-intelligent email suggested this reply: "I'm down with whatever." 2/2";;@ughesq @LadyLegalWriter;;"666041550980411396";https://twitter.com/JenniferMRomig/status/666041550980411396
;2015/11/06 02:24;0;3;"Just had my first Google Inbox intelligent auto-response experience. Insane!";;;;"662455610198200320";https://twitter.com/kul/status/662455610198200320
;2015/10/22 15:55;0;3;"I'm pretty sure the auto attendant on my AMEX corporate card just gave me an attitude back- the latest in intelligent IVR? #IVR #CX";;;#IVR #CX;"657208543544676352";https://twitter.com/MelissaJaneOB/status/657208543544676352
;2015/09/29 12:00;2;1;"JW950 iron has intelligent Auto Valve to prevent water leakage & keep your clothes stain free! Now that's Anti-Drip pic.twitter.com/5Ymyhm5hwy";;;;"648814566625800192";https://twitter.com/Panasonic_MEA/status/648814566625800192
;2015/09/08 07:17;17;12;"DJI updates Phantom 3 drones with new 'Intelligent Flight Modes,' including auto-follow http://forums.appleinsider.com/t/188070/dji-updates-phantom-3-drones-with-new-intelligent-flight-modes-including-auto-follow …pic.twitter.com/sM5IBt1xdB";;;;"641133222873669632";https://twitter.com/R2Drones/status/641133222873669632
;2015/08/24 08:06;1;2;"Why do intelligent people sign on to robot auto-tweeters that rifle their follower lists to build their own databases?";;;;"635709766749192192";https://twitter.com/R_Chirgwin/status/635709766749192192
;2015/08/19 11:37;3;9;"Intelligent Idiots :Look Noumura Recommended AMTEK Auto -Last Year at 274 with Target of… http://www.anirudhsethireport.com/intelligent-idiots-look-noumura-recommended-amtek-auto-last-year-at-274-with-target-of-416-see-what-happened/ …pic.twitter.com/rHHwebx7wi";;;;"633950882300735488";https://twitter.com/BrainandMoney/status/633950882300735488
;2015/08/17 06:22;0;5;"Should I know more about cars? Are people that know more about cars seen as intelligent or mid-western auto shop enthusiasts?";;;;"633146758374158336";https://twitter.com/SpencerCVx/status/633146758374158336
;2015/05/19 03:56;2;10;"Photive 50 Watt 6 Port USB Desktop Rapid Charger. Intelligent USB Charger with Auto Detect Technology http://amzn.to/1Fl6Hkt ";;;;"600495306979999744";https://twitter.com/dealverse/status/600495306979999744
;2015/05/14 17:44;0;8;"Intelligent, auto tinting glass by @viewglasspic.twitter.com/14F5nmhYZK";;@viewglasspic;;"598891768776663040";https://twitter.com/archpaper/status/598891768776663040
;2015/02/24 10:47;0;5;"Finally stopped all intelligent thinking, gonna sleep hard. P.s. I used auto correct on every single word of that sentence";;;;"570173110952919041";https://twitter.com/BigRossHossBoss/status/570173110952919041
;2015/02/21 09:56;6;2;"Rajiv Bajaj, CMD Bajaj Auto also says. @ArvindKejriwal is scrupulously honest, stunningly intelligent & brave pic.twitter.com/AWHqjamL3v";;@ArvindKejriwal;;"569073113926742018";https://twitter.com/ReallyGupta/status/569073113926742018
;2015/02/21 05:49;5;3;"DrumUp is your Intelligent, Personal Social Media Manager. It auto discovers content to post on.. http://drumup.io  #socialmedia";;;#socialmedia;"569011064894935041";https://twitter.com/hichamchraibi/status/569011064894935041
;2015/02/18 09:56;5;7;"@kalkikanmani Is auto-correct the culprit? It's 'defiantly' made me look 'stupor' :D Not that I'm saying I'm intelligent or sumat :P";;@kalkikanmani;;"567985973738541057";https://twitter.com/SteveUnknown/status/567985973738541057
;2015/02/02 17:16;0;5;"Pro tip: talking louder does not make you sound intelligent Also: just auto-corrected intelligent";;;;"562298498910269440";https://twitter.com/thedragstate/status/562298498910269440
;2014/12/13 04:54;1;11;"My very intelligent Phone Just auto Corrected "bf" to "Fb"; Ya can't spell "always Online" without A-l-o-n-e";;;;"543630104233279488";https://twitter.com/fad_albert/status/543630104233279488
