username;date;retweets;favorites;text;geo;mentions;hashtags;id;permalink
;2019/06/21 04:27;59;142;"UPDATE: I picked the call Pls recommend schools that would afford a PhD in Cybersecurity for special focus on New/Emerging Tech like: + IoT + Artificial Intelligence + Blockchain + Machine Learning ...and application in Financial Services, Telecoms, Health, or Transportation. https://twitter.com/WaleMicaiah/status/1141135843245088769 …";;;;"1141910592971841537";https://twitter.com/WaleMicaiah/status/1141910592971841537
;2019/06/18 12:30;20;14;"Artificial Intelligence in the Automotive Industry – an Analysis of the Space https://buff.ly/2UehFoK  v/ @Emerj #Transportation #SelfDrivingCars #MachineLearning #IoT #Robotics #BigData #Analytics Cc @SpirosMargaris @JimMarous @psb_dc @andi_staub @schmarzo @evankirstelpic.twitter.com/g5RYtAYRJM";;@Emerj @SpirosMargaris @JimMarous @psb_dc @andi_staub @schmarzo @evankirstelpic;#Transportation #SelfDrivingCars #MachineLearning #IoT #Robotics #BigData #Analytics;"1140944799526281216";https://twitter.com/ipfconline1/status/1140944799526281216
;2019/06/09 12:06;15;17;"How Artificial Intelligence and Machine Learning Are Revolutionizing #Logistics, Supply Chain and #Transportation https://bit.ly/2ZekWGA  @Entrepreneur #ArtificialIntelligence #DataScience #SupplyChain #BigData #DeepLearning #MachineLearning #DigitalTransformation #AIpic.twitter.com/xWzTfojmeR";;@Entrepreneur;#Logistics #Transportation #ArtificialIntelligence #DataScience #SupplyChain #BigData #DeepLearning #MachineLearning #DigitalTransformation #AIpic;"1137677459468574720";https://twitter.com/marcusborba/status/1137677459468574720
;2019/05/22 23:31;68;411;"Ah, we forgot to mention in our analysis of batteries, artificial intelligence, robots, and autonomous systems that, as it disrupts most other traditional #auto companies, $TSLA is an #EV company morphing into a transportation-as-a-service (think SaaS) company. https://twitter.com/smigliore15/status/1131316027160170497 …";;;#auto #EV;"1131326729174364160";https://twitter.com/CathieDWood/status/1131326729174364160
;2019/05/22 21:40;120;830;"No other investment firm has three analysts, with expertise in batteries, robots, artificial intelligence, and autonomous transportation networks focused on this investment opportunity. https://twitter.com/ARKInvest/status/1131292664882782209 …";;;;"1131298694089924608";https://twitter.com/CathieDWood/status/1131298694089924608
;2019/05/17 13:00;10;50;"Deals include investments in electronics, manufacturing, and artificial intelligence, as well as agreements related to energy, transportation, and tourism including theme parks. https://bit.ly/2WNujML ";;;;"1129355891248062466";https://twitter.com/cnnphilippines/status/1129355891248062466
;2019/05/16 18:46;219;930;"Use Artificial Intelligence(AI) to solve challenges faced by India:Requested ministries to identify projects where AI can be leveraged for social development & inclusive growth. Focus sectors are healthcare, agriculture, education, smart cities , transportation & smart mobility.";;;;"1129080675825475584";https://twitter.com/amitabhk87/status/1129080675825475584
;2019/05/16 17:12;6;19;"The Artificial intelligence and Africa's digital economy session discussed how technologies such as AI, blockchain and IoT will be a key contributor in creating improved and efficient access to healthcare, transportation to name a few. #TAS2019 #Rwandapic.twitter.com/Gm6yUrnHLz";;;#TAS2019 #Rwandapic;"1129057083226316800";https://twitter.com/mukamana25/status/1129057083226316800
;2019/05/10 19:32;15;80;"UoM will starts new courses at School of Engineering and Applied Sciences at Kalyan 1) MTech In Computer Engineering 2) MTech In Chemical Engineering & Technology 3) MTech In Artificial Intelligence 4) MTech in Transportation Engineering 5)MSC in Oceanography & PhD programs.";;;;"1126917826160123904";https://twitter.com/Uni_Mumbai/status/1126917826160123904
;2019/04/07 22:15;12;23;"It is impossible to ignore the apparent impact of artificial intelligence in our everyday lives. Some of the most impacted industries: Transportation Manufacturing Entertainment #AI #Robotics #ML #NLP @karpathy @NipsConference @soumithchintalahttp://ow.ly/pYpe30om8p8 ";;@karpathy @NipsConference @soumithchintalahttp;#AI #Robotics #ML #NLP;"1115000054417432579";https://twitter.com/SwissCognitive/status/1115000054417432579
;2019/03/18 21:41;8;26;"2. Boeing MAX fiasco is a reminder that as more Artificial Intelligence enters healthcare, transportation, manufacturing, education, military…we need not only better, ethical engineers, but also more capable and ethical watchdogs who can run proper safety checks on AI systems.";;;;"1107758909538910208";https://twitter.com/Khanoisseur/status/1107758909538910208
;2019/03/18 16:14;7;16;"Nokia joins Pöyry and Infosys India to enhance artificial intelligence framework for industry, utilities, transportation & infrastructure organizations ? @Infosys? ? @nokia? ? @Poyryplc?https://www.globenewswire.com/news-release/2019/03/14/1754901/0/en/Nokia-joins-P%C3%B6yry-and-Infosys-to-enhance-the-artificial-intelligence-framework-for-industry-utilities-transportation-and-infrastructure-organization.html#.XI6fWpePAkc.whatsapp …";;@Infosys @nokia @Poyryplc;#;"1107676601834266624";https://twitter.com/IndEmbFinEst/status/1107676601834266624
;2019/03/04 07:50;54;110;"Four Centre of Excellence being established together with China: - Artificial Intelligence - HighSpeec Transportation (Bullet train for Export Purpose) - Food Technology & processing - Minerals Development Dr Atta said these likely to start in coming FY";;;;"1102476478346719232";https://twitter.com/Yasirmcheema/status/1102476478346719232
;2019/02/25 20:16;10;79;"- which we have today,  from solar power to wind energy, from Artificial Intelligence to automation which could radically change transportation for instance, so that we wouldn't have polluting cars, diesel or fossil fuel, but only electric cars or trains for instance,";;;;"1100127327231660033";https://twitter.com/pamfoundation/status/1100127327231660033
;2019/02/12 21:26;6;14;"Congrats to GWU’s Transportation Team, winner of @OCTODC's #GigabitDCx challenge! The Road Vision app from the team at @GWtweets uses Artificial Intelligence (AI) methods to translate video feeds into traffic mobility and safety information (traffic counts, speeds). pic.twitter.com/JE6W8frlcs";;@OCTODC @GWtweets;#GigabitDCx;"1095434063752630273";https://twitter.com/US_Ignite/status/1095434063752630273
;2019/01/11 06:30;17;29;"Top Five Sustainability Trends 2019. The rise of sustainability practices in unexpected places using innovative applications of cutting edge technologies; ?Artificial intelligence|?Sustainability professionals|?Transportation ?Agriculture ?Carbon Tax pic.twitter.com/xuVhWRpFiu";;;;"1083612000775782400";https://twitter.com/EmmanuelNnko/status/1083612000775782400
;2019/01/06 13:00;6;9;"Artificial intelligence, energy, transportation. The way we live and work will undergo fundamental shifts over th... https://goo.gl/nMhPXr ";;;;"1081898190889279488";https://twitter.com/DanielNTorres/status/1081898190889279488
;2019/01/03 15:45;9;18;"Artificial Intelligence at airports: how is #AI speeding up #security? https://zurl.co/1uhF  #transportation #airport #trust cc @evankirstel @ipfconline1 @SpirosMargaris @HaroldSinnott @sallyeaves @Paula_Piccard @MikeQuindazzi @YuHelenYu @Ronald_vanLoon @diioannid @nigewillsonpic.twitter.com/OlsoPSXK4o";;@evankirstel @ipfconline1 @SpirosMargaris @HaroldSinnott @sallyeaves @Paula_Piccard @MikeQuindazzi @YuHelenYu @Ronald_vanLoon @diioannid @nigewillsonpic;#AI #security #transportation #airport #trust;"1080852722570665984";https://twitter.com/thejef4/status/1080852722570665984
;2018/12/30 15:30;6;26;"I think with artificial intelligence taking over warehousing, retail, public transportation etc there’s a major need for a citizen income. Otherwise homelessness will increase as will zero hour contracts and foodbanks";;;;"1079399426060357633";https://twitter.com/Shackviral/status/1079399426060357633
;2018/12/23 18:07;9;16;"Many thanks to @Babatee760 @Cyberdroidmann and @SadeeqAkintola for helping breakdown Artificial Intelligence and Data Science down and it's so many applications in Transportation, Imagery, Gaming and Healthcare. A replay link will be shared for those that missed it. pic.twitter.com/8AA5iVoEa7";;@Babatee760 @Cyberdroidmann @SadeeqAkintola;;"1076902188771930112";https://twitter.com/Rx_Deyholar/status/1076902188771930112
;2019/06/25 20:25;5;11;"7 ways the UAE is leading the way with Artificial Intelligence #AI #strategy #Transportation #education #Government #healthcare @HaroldSinnott @Fabriziobustama @mvollmer1 @HeinzVHoenen @jamesvgingerich @PALOMBAGI @Procurement2030 @ProcurementStarhttps://stepfeed.com/7-ways-the-uae-is-leading-the-way-with-artificial-intelligence-9038 …";;@HaroldSinnott @Fabriziobustama @mvollmer1 @HeinzVHoenen @jamesvgingerich @PALOMBAGI @Procurement2030 @ProcurementStarhttps;#AI #strategy #Transportation #education #Government #healthcare;"1143601237721571331";https://twitter.com/munir_alhaddad/status/1143601237721571331
;2019/06/09 10:27;5;11;"How Artificial Intelligence and Machine Learning Are Revolutionizing Logistics, Supply Chain and Transportation - Entrepreneur https://www.entrepreneur.com/article/335002  vía @GoogleNews";;@GoogleNews;;"1137652420559953920";https://twitter.com/XavierFerras/status/1137652420559953920
;2019/06/08 21:00;3;8;"Artificial Intelligence Driving the Future of Transportation, But Miles of Red Tape Holding It Back http://go.cbn.com/32883 ";;;;"1137449218937896960";https://twitter.com/CBNNews/status/1137449218937896960
;2019/05/04 10:12;10;7;"#TES2019 Conversations at The Engineering Summit, Africa will focus on these key sectors; 1. Power and Energy 2. Healthcare 3. Agriculture 4. Oil and Gas 5. Transportation 6. Artificial intelligence Don't miss out!! Visit: http://www.theengineeringsummit.ng  to Reserve your SEAT For Free";;;#TES2019;"1124602797964525568";https://twitter.com/_Abdulquyum/status/1124602797964525568
;2019/05/04 08:01;6;4;"Artificial Intelligence in the Automotive Industry – an Analysis of the Space https://buff.ly/2UehFoK  v/ Emerj #Transportation #SelfDrivingCars #MachineLearning #IoT #Robotics #BigData #Analytics Cc SpirosMargaris JimMarous psb_dc andi_staub schmarz…pic.twitter.com/fJ9IS3xNew";;;#Transportation #SelfDrivingCars #MachineLearning #IoT #Robotics #BigData #Analytics;"1124569621602930689";https://twitter.com/TheIotWarehouse/status/1124569621602930689
;2019/04/30 09:24;9;4;"#TES2019 The key industries to be explored at the summit include: Power and Energy, Healthcare, Agriculture, Oil and Gas, Transportation, Artificial intelligence and Internet of Things. To know more. Visit: http://www.theengineeringsummit.ng  to reserve your Seat for free.";;;#TES2019;"1123140965483655168";https://twitter.com/sir_sapphire/status/1123140965483655168
;2019/04/22 18:47;2;8;"The ethics of data and artificial intelligence in healthcare, pharma, retail, transportation; this discussion is relevant across industries. #SEAWiT19 #MachineLearning #innovation";;;#SEAWiT19 #MachineLearning #innovation;"1120383541907316738";https://twitter.com/rachelgersonmd/status/1120383541907316738
;2019/04/18 10:01;7;9;"So our Founder, Toyosi Akerele-Ogunsiji @toyosirise visited MIT Science Lab @MITCities @medialab 3weeks ago to see how Students are collaborating to solve the problems relating to urban transportation& building smart cities in their different countries. #artificial_intelligence pic.twitter.com/GK27VWDrCe";;@toyosirise @MITCities @medialab;#artificial_intelligence;"1118801794761658375";https://twitter.com/Risenetworks/status/1118801794761658375
;2019/04/12 18:42;6;10;"Artificial Intelligence (AI) is the driving force for the Fourth Industrial Revolution, and developed economies are taking full advantage of AI technologies in making breakthrough advances in healthcare, education, transportation... #SMSGAfrica #CitiesUponAHill";;;#SMSGAfrica #CitiesUponAHill;"1116758384433401856";https://twitter.com/hbkwara/status/1116758384433401856
;2019/04/08 17:53;8;11;"Great opportunity to here from @shara_evans about transportation future in smart cities and the future of artificial intelligence. pic.twitter.com/DeCdwGWQ69";;@shara_evans;;"1115296649650233344";https://twitter.com/ahmed_al_azizi/status/1115296649650233344
;2019/03/26 19:20;13;8;"The AI in Transportation Report: How automakers can use artificial intelligence to cut costs, open new revenue streams, and adapt to the digital age http://www.businessinsider.com/ai-in-transportation-report-2019-3 …";;;;"1110622460179828736";https://twitter.com/businessinsider/status/1110622460179828736
;2019/03/11 16:00;3;6;"It will be awesome for Clayton to finally have a College and Career Academy offering Career Pathways in Aviation, Artificial Intelligence, Logistics-Transportation, Sports Medicine & Officiating, just to name a few areas. Our students deserve a state of the art facility for such. pic.twitter.com/qqtFPrkltD";;;;"1105136405985087488";https://twitter.com/MorceaseBeasley/status/1105136405985087488
;2019/02/27 16:39;6;11;"One of the key areas where artificial intelligence, machine learning and other new technologies are playing a major role is road transportation. Here are four startups working on innovative solutions. @pacetelematics @embotechAG @WayRay @VALERANN_LTDhttp://ow.ly/A0tP30nRfrK ";;@pacetelematics @embotechAG @WayRay @VALERANN_LTDhttp;;"1100797473243758594";https://twitter.com/asmagglobal/status/1100797473243758594
;2019/02/19 14:24;9;13;"A mix of products and solutions on Artificial Intelligence, IoT, Mixed Reality, Data Science, CX Management, Smart Energy and Power, Health and Wellness, Mobility and Smart Transportation will be on display at the event. #ISW2019 #FBStartAccelerator #CcHUB";;;#ISW2019 #FBStartAccelerator #CcHUB;"1097864423790784513";https://twitter.com/Cc_HUB/status/1097864423790784513
;2019/02/12 21:04;1;9;"Proud to help award $25,000 to @GWtweets Transportation Team for their work developing artificial intelligence to translate video feeds into mobility and safety data. Impressive local talent supporting @DCVisionZero efforts! @OCTODC @US_Ignite #GigabitDCx https://www.herox.com/gigabitDCx/update/2598 …pic.twitter.com/tBIsGC4GFb";;@GWtweets @DCVisionZero @OCTODC @US_Ignite;#GigabitDCx;"1095428363777441792";https://twitter.com/s4xton/status/1095428363777441792
;2019/01/22 17:07;3;7;""The internet is no longer led by the US alone. As digital applications spread into transportation, aviation, healthcare and energy, China is leading specific areas in artificial intelligence, advanced robots and e-commerce..." https://twitter.com/ConversationUK/status/1087615437800652801 …";;;;"1087758547297988609";https://twitter.com/cscolari/status/1087758547297988609
;2019/01/11 14:55;5;10;"#AutonomousVehicles are the future of #transportation. @ETH_en launched a competition for autonomous driving, the “Artificial Intelligence Driving Olympics”. Learn more about how rubber ducks contributed to the advancement of the technology: https://bit.ly/2JvDHyp  #SwissTechpic.twitter.com/iFFCsfgW0Y";;@ETH_en;#AutonomousVehicles #transportation #SwissTechpic;"1083739298980159488";https://twitter.com/SwissEmbassyUSA/status/1083739298980159488
;2019/01/04 06:48;2;8;"Artificial Intelligence at airports: how is #AI speeding up #security? https://zurl.co/1uhF  #transportation #airport #trust cc @evankirstel @ipfconline1 @SpirosMargaris @sallyeaves @Paula_Piccard @MikeQuindazzi @YuHelenYu @Ronald_vanLoon @nigewillsonpic.twitter.com/sGEdDG7IyZ";;@evankirstel @ipfconline1 @SpirosMargaris @sallyeaves @Paula_Piccard @MikeQuindazzi @YuHelenYu @Ronald_vanLoon @nigewillsonpic;#AI #security #transportation #airport #trust;"1081079860926316545";https://twitter.com/edmuke/status/1081079860926316545
;2018/12/05 22:15;17;6;"Transportation and retail companies are likely to be the most transformed by artificial intelligence, says UBS. https://blogs.wsj.com/cio/2018/12/04/retail-transportation-among-industries-most-impacted-by-ai/ … via @WSJ";;@WSJ;;"1070441434677944320";https://twitter.com/PaulPage/status/1070441434677944320
;2018/10/24 18:52;45;130;"Prime Minister Benjamin Netanyahu and Chinese Vice President Wang Qishan toured the innovation exhibit at which five Israeli companies presented their inventions in the fields of agriculture, medicine, smart transportation, advanced vision technology and artificial intelligence. pic.twitter.com/uk8VOXdnp2";;;;"1055155087033724928";https://twitter.com/IsraeliPM/status/1055155087033724928
;2018/10/22 16:15;20;107;"Mr. Jensen Huang talked about Artificial Intelligence, potential to leverage it across sectors like transportation, education, healthcare etc. Democratization of technology will make it more accessible #AIForAllpic.twitter.com/e8LC1MFkz2";;;#AIForAllpic;"1054390869883637760";https://twitter.com/dpradhanbjp/status/1054390869883637760
;2018/09/18 11:00;50;85;"How artificial intelligence and machine learning are revolutionizing logistics, supply chain and transportation http://on.forbes.com/6019DFEYT  #paid @PenskeNewspic.twitter.com/Hr8CaUmTmD";;@PenskeNewspic;#paid;"1041990216008048641";https://twitter.com/Forbes/status/1041990216008048641
;2018/09/12 05:41;39;56;"How Artificial Intelligence And #Machine #Learning Are Revolutionizing #Logistics, Supply Ch#AIn And #Transportation #CEO #Deep_Learning #Machine_Learning #Education #Research @SwissCognitive - The Global AI Hubhttp://bit.ly/2CvtT84 ";;@SwissCognitive;#Machine #Learning #Logistics #AIn #Transportation #CEO #Deep_Learning #Machine_Learning #Education #Research;"1039735835065835525";https://twitter.com/DalithSteiger/status/1039735835065835525
;2018/09/07 20:34;13;41;"2,5 hour long interview on artificial intelligence, electric transportation, climate change, brain computer interfaces and more Media: pic.twitter.com/xvBi9N0iGb";;;;"1038148409046257664";https://twitter.com/jurn_w/status/1038148409046257664
;2018/08/21 05:15;46;35;"New human rights principles on artificial intelligence #Communication #CTO #Deep_Learning #Learning #Machin #Machine_Learning #AI #Education #Media #Transportation http://bit.ly/2LgbivA ";;;#Communication #CTO #Deep_Learning #Learning #Machin #Machine_Learning #AI #Education #Media #Transportation;"1031756719490322432";https://twitter.com/SwissCognitive/status/1031756719490322432
;2018/08/09 22:00;16;22;"Artificial Intelligence: How it Could Transform Transportation @GlobalTradeMag Magazine http://bit.ly/2vQKwnX  #AI #MachineLearning #DeepLearning #BigData #Fintech #Insurtech #Datascience #ML #Robotics #HealthTech #IoT #Marketing #transportation @MikeQuindazzi @David_Worley1pic.twitter.com/AesWD3ui7B";;@GlobalTradeMag @MikeQuindazzi @David_Worley1pic;#AI #MachineLearning #DeepLearning #BigData #Fintech #Insurtech #Datascience #ML #Robotics #HealthTech #IoT #Marketing #transportation;"1027660909630685184";https://twitter.com/JeffreyBuskey/status/1027660909630685184
;2018/07/28 05:22;23;38;"The artificial intelligence crossroads in Formula 1 #Autonomous_Car #CEO #Deep_Learning #IBM #Learning #Machin #Machine_Learning #AI #Automotive #Events #Transportation @SwissCognitive - The Global AI Hubhttp://bit.ly/2LFL2ff ";;@SwissCognitive;#Autonomous_Car #CEO #Deep_Learning #IBM #Learning #Machin #Machine_Learning #AI #Automotive #Events #Transportation;"1023061225817747456";https://twitter.com/DalithSteiger/status/1023061225817747456
;2018/07/25 12:40;9;32;""We are about to witness the world we live in entirely disrupted by improvements in artificial intelligence and machine learning... the top 3 industries that will suffer: - Transportation - Criminal Justice - Advertising" { author: @xanthonydelgado } https://dev.to/anthonydelgado/ai-will-take-over-most-human-jobs-by-2030-262l …";;@xanthonydelgado;;"1022084044874547200";https://twitter.com/ThePracticalDev/status/1022084044874547200
;2018/07/08 23:30;40;34;"Everyday Examples of Artificial Intelligence and #MachineLearning https://buff.ly/2vwnIwS  v/ @TechEmergence #AI #DeepLearning #NLP #Fintech #CyberSecurity #EdTech #Transportation #SocialMedia #Marketing #DigitalMarketingpic.twitter.com/UPOOORGEiv";;@TechEmergence;#MachineLearning #AI #DeepLearning #NLP #Fintech #CyberSecurity #EdTech #Transportation #SocialMedia #Marketing #DigitalMarketingpic;"1016087070333374464";https://twitter.com/ipfconline1/status/1016087070333374464
;2018/06/05 12:30;32;95;"#NITIAayog has identified five sectors - healthcare, agriculture, education, smart cities and infrastructure & transportation to focus its efforts towards implementation of artificial intelligence #AI to serve societal needs: @FinancialXpress #AIForAllhttps://www.financialexpress.com/economy/niti-aayog-releases-national-strategy-on-artificial-intelligence-identifies-these-5-focus-areas/1193286/ …";;@FinancialXpress;#NITIAayog #AI #AIForAllhttps;"1003962176338563073";https://twitter.com/NITIAayog/status/1003962176338563073
;2018/05/31 16:45;10;19;"Monocle names Reaktor the Top B2B Technology Player in the transportation field. Highlighting our work with @Finavia at @HelsinkiAirport, where we use artificial intelligence to understand passenger data and improve visitor experiences! http://ow.ly/ZKSd50huGNp pic.twitter.com/7gtKI5h7ZZ";;@Finavia @HelsinkiAirport;;"1002214466946240512";https://twitter.com/ReaktorNow/status/1002214466946240512
;2018/05/31 15:21;20;13;">50% of the world’s people live in cities. This creates challenges in housing, transportation, energy systems,... Smart Cities, using ICTs and artificial intelligence solutions, can improve quality of life for their residents https://goo.gl/xs4aDB  #AIforGood";;;#AIforGood;"1002193467437735937";https://twitter.com/ITU/status/1002193467437735937
;2018/05/28 02:07;6;35;"Looking forward to co-presenting tomorrow on Transport Canada’s exploratory work on the integration of Artificial Intelligence to augment transportation safety oversight! See you at #GCAIDay";;;#GCAIDay;"1000906362396622848";https://twitter.com/_trajan/status/1000906362396622848
;2018/05/18 08:56;16;45;"This year's World Intelligence Congress underway in north China's Tianjing is focused on Artificial Intelligence ( #AI), the technology that helps make transportation faster, safer, more comfortable. http://bit.ly/2x0ZQCv  #WorldIntelligenceCongresspic.twitter.com/nJBak3708k";;;#AI #WorldIntelligenceCongresspic;"997385382642700288";https://twitter.com/ChinaPlusNews/status/997385382642700288
;2018/05/06 18:22;28;165;"The year is 2074 Self-driving cars is now the standard form of transportation There's super-smart artificial intelligence that is smarter than humans James Milner still playes left back for Liverpool FC";;;;"993179252530057216";https://twitter.com/F_Edits/status/993179252530057216
;2018/04/27 22:47;14;16;"Nine steps for maximizing the benefits of artificial intelligence in in finance, national security, health care, criminal justice, transportation, and smart cities https://brook.gs/2HnDfVn ";;;;"989984283862487040";https://twitter.com/BrookingsInst/status/989984283862487040
;2018/03/29 07:45;14;12;"Nouriel Roubini, Economist and CEO, Roubini Macro Associates LLC: Electric vehicles will become more popular leading to a cleaner transportation system. Also, artificial intelligence will be a key area to look forward to. #IEC2018";;;#IEC2018;"979248059052773376";https://twitter.com/ETNOWlive/status/979248059052773376
;2017/12/15 13:06;54;186;"There is a huge potential of collaboration in Energy Sector among institutions in several areas such as EOR, Use of LNG in Railways, coastal shipping, inter-city transportation, Internet of Things, Robotics & Artificial Intelligence.";;;;"941655691311439879";https://twitter.com/dpradhanbjp/status/941655691311439879
;2017/12/11 16:13;165;92;"Artificial Intelligence and Supercomputers to Help Alleviate Urban Traffic Problems Image Texas Advanced Computing Center/Center for Transportation Research #AI #MachineLearning #DeepLearning #BigData #ML #DL #tech https://news.utexas.edu/2017/12/11/ai-and-supercomputers-help-alleviate-urban-traffic-problems … pic.twitter.com/JC84Ykdlx1";;;#AI #MachineLearning #DeepLearning #BigData #ML #DL #tech;"940253211700670466";https://twitter.com/DeepLearn007/status/940253211700670466
;2017/11/25 16:38;60;231;"Humans may save more lives by applying machine learning & artificial intelligence to medicine and transportation than all philanthropy has saved in the last 3 decades combined. There is no better investment than technology.";;;;"934461406245785600";https://twitter.com/APompliano/status/934461406245785600
;2017/07/17 13:30;10;9;"Artificial intelligence research makes public transportation more accessible. Learn more: http://abc7ne.ws/2uzw4Cx  #A11y #AI #Tech";;;#A11y #AI #Tech;"886926018388385793";https://twitter.com/G3ict/status/886926018388385793
;2017/07/13 14:25;5;3;"Artificial intelligence research helping the disabled use public #transportation http://ow.ly/Rsit30dBgo9  (via @abc7david) #accessibility #AI";;@abc7david;#transportation #accessibility #AI;"885490473896464384";https://twitter.com/IBMAccess/status/885490473896464384
;2017/07/08 01:55;6;14;"Transportation, public safety, work, and more. Will artificial intelligence soon rule the way people live in cities? http://bit.ly/2u0z2Qn pic.twitter.com/I8kyOZh7Wc";;;;"883489591436685312";https://twitter.com/AIANational/status/883489591436685312
;2017/07/07 20:34;3;4;"Q&A: Artificial intelligence expert Raquel Urtasun on the complicated future of transportation #StartUpHereTO http://buff.ly/2tSTkuY ";;;#StartUpHereTO;"883408792439992320";https://twitter.com/startuphereTO/status/883408792439992320
