username;date;retweets;favorites;text;geo;mentions;hashtags;id;permalink
;2019/07/12 20:16;0;0;"2019 Newest SmartWatch Intelligent Programing Education RC Robot Auto Follow Gesture Control Kids Toys Blue White https://gadget-shop.info/2019-newest-smartwatch-intelligent-programing-education-rc-robot-auto-follow-gesture-control-kids-toys-blue-white/ …pic.twitter.com/FeoBoTfHf9";;;;"1149759329203032065";https://twitter.com/GadgetShop11/status/1149759329203032065
;2019/07/12 18:21;1;0;"Did you know: About 40% of auto industry profits will be advanced through #mobility tech by 2035. See how automotive companies can benefit from SAP to transform business models with intelligent technologies for competitive differentiation http://sap.to/6019Ev34N pic.twitter.com/4bi94Q04jn";;;#mobility;"1149730391206576139";https://twitter.com/SAPAutomotive/status/1149730391206576139
;2019/07/12 17:59;0;0;"NEW VAPE ALERT IPV V3-MINI 30W AUTO-SQUONK POD SYSTEM by @ipv.official @thevaporshop integrating multiple intelligent control systems, an advanced YiHi SX635J chipset, and comes packing a spacious 1400mAh rechargeable battery within the visually striking chassis. D… pic.twitter.com/FgWIP4gNlg";;@ipv @thevaporshop;;"1149724972417519616";https://twitter.com/TheVaporShopLA/status/1149724972417519616
;2019/07/12 15:23;0;0;""Quality is never an accident. It is always the result of intelligent effort." -John Ruskin -Do you have a favorite quote you would like to share? pic.twitter.com/i72LIO2wti";;;;"1149685835962306560";https://twitter.com/2HourAutoGlass/status/1149685835962306560
;2019/07/12 08:35;0;1;"@ECSEL_AutoDrive presented at 10th #IFAC Symposium on #Intelligent #Autonomous #Vehicles by Jose Angel Matute @tecnalia representativepic.twitter.com/s8QJnubyvM";;@ECSEL_AutoDrive @tecnalia;#IFAC #Intelligent #Autonomous #Vehicles;"1149583140727300096";https://twitter.com/ECSEL_AutoDrive/status/1149583140727300096
;2019/07/12 07:31;0;0;"Generation 6 intelligent induction auto wax injection system produced by Panhuahang Jewelry Tools Equipment Co., Ltd. is deeply loved by the customers in China. If you try, you will love it too. #waxinjectionmachinepic.twitter.com/O1Rx1GlzY9";;;#waxinjectionmachinepic;"1149566923320909824";https://twitter.com/PanHuaHangWIN/status/1149566923320909824
;2019/07/11 17:47;0;1;"Auto Response Codes DISCOVERED In Plants Like Venus Fly Trap Suggests Intelligent Design?! | FYM NEWS http://youtube.com/watch?v=WHOpQhrJr-U&feature=youtu.be …https://feedyourmind1.com/auto-response-codes-discovered-in-plants-like-venus-fly-trap-suggests-intelligent-design-fym-news/ …";;;;"1149359454368010240";https://twitter.com/FeedYourMind6/status/1149359454368010240
;2019/07/11 17:14;0;0;"Nutri Ninja Bowl Duo Reviews | Product ItemsNutri Ninja Nutri Bowl Duo is a multi-functional and intelligent blender. Yes, it has unique a unique feature of auto IQ technology that combines timely https://productitems.com/nutri-ninja-duo-reviews/ … pic.twitter.com/wolhFJntdM";;;;"1149351212745154560";https://twitter.com/productitems/status/1149351212745154560
;2019/07/11 06:05;0;0;"Find tips to purchase a auto packing machine with a cost-effective price: http://tzpackaging.com  #autopackingmachine #liquidpackingmachine #fillingpackagingmachinepic.twitter.com/qpsxumWyfu";;;#autopackingmachine #liquidpackingmachine #fillingpackagingmachinepic;"1149182883954716673";https://twitter.com/tzpackaging/status/1149182883954716673
;2019/07/10 16:32;0;2;"Bhaii.. I was born intelligent but my phone auto dictionary ruined me..";;;;"1148978291467964416";https://twitter.com/Chanaky49747426/status/1148978291467964416
;2019/07/10 13:10;1;1;"[New Blog] Intelligent Monitoring: Auto-Focus for Malware Analysts. Learn how our Intelligent Monitoring technology captures everything that’s relevant and only what’s relevant from an analysis. https://www.vmray.com/cyber-security-blog/intelligent-monitoring-technology/ … #DFIRpic.twitter.com/qgb6cQw8LI";;;#DFIRpic;"1148927588401909760";https://twitter.com/vmray/status/1148927588401909760
;2019/07/10 07:34;0;6;"@ECSEL_AutoDrive concept related to #AI in #highlyautomated cars ( #HAD) presented in 32nd #International Conference on #Industrial, #Engineering & Other #Applications Of #Applied #Intelligent #Systems #IEAAIE2019pic.twitter.com/lTH2C8ADOf";;@ECSEL_AutoDrive;#AI #highlyautomated #HAD #International #Industrial #Engineering #Applications #Applied #Intelligent #Systems #IEAAIE2019pic;"1148842907861946368";https://twitter.com/ECSEL_AutoDrive/status/1148842907861946368
;2019/07/09 17:11;1;2;"AMY Robot is a service robot with three basic features: intelligent voice interaction with humans, auto-navigation with obstacle avoidance and applications developable with SDK/API documents. https://ozrobotics.com/shop/amy-robot/#.XSS8Un1MOnM.twitter …";;;#;"1148625724754075656";https://twitter.com/OzRoboticsUSA/status/1148625724754075656
;2019/07/07 03:31;0;0;"#hashtag4 INQMEGA HD 1080P Cloud Wireless IP Camera Intelligent Auto Tracking Of Human Home Security Surveillance CCTV Network Wifi Camera pic.twitter.com/iG4B7fDM4q";;;#hashtag4;"1147694644098207744";https://twitter.com/gadgetzenstore/status/1147694644098207744
;2019/07/06 19:00;0;0;"Appreciate a confident ride no matter what the road conditions might be in this 2019 #Nissan Altima SV! The Altima is the first Nissan sedan with an Intelligent All-Wheel Drive System #Guelph #Ontario #auto https://1l.ink/Z4QBKBN pic.twitter.com/Y9sgtJRmIR";;;#Nissan #Guelph #Ontario #auto;"1147565981046312966";https://twitter.com/GuelphNissan/status/1147565981046312966
;2019/07/05 16:24;0;0;"(2/7) Your timetable lives on a dashboard that's as simple & familiar as any other calendar- the only difference is that all your (teacher-written) revision topics are already pre-loaded into our intelligent algorithm and auto-scheduled into the times you've told us you're free pic.twitter.com/z6KtKIOLB6";;;;"1147164299456131072";https://twitter.com/helloadapt/status/1147164299456131072
;2019/07/05 08:18;6;2;"#Baidu partners with #Geely for intelligent #mobility solutions https://auto.economictimes.indiatimes.com/news/industry/baidu-partners-with-geely-for-intelligent-mobility-solutions/70074401 … #autonomous #SmartCity #AI #IoT #Robotics #tech #5G #driverless #selfdriving #SelfDrivingCars #startup #technology #DriverlessCars #Robots #startups #transport #Travel #delivery #robot #auto pic.twitter.com/gFgFd0e5j7";;;#Baidu #Geely #mobility #autonomous #SmartCity #AI #IoT #Robotics #tech #5G #driverless #selfdriving #SelfDrivingCars #startup #technology #DriverlessCars #Robots #startups #transport #Travel #delivery #robot #auto;"1147042145280417792";https://twitter.com/guidaautonoma/status/1147042145280417792
;2019/07/04 04:37;0;0;"#XTUNER T1 Heavy Duty Trucks Scanner Wifi XTUNER T1 HD Heavy Duty Truck Auto Intelligent Diagnostic Tool Jenny Guo>>>Whatsapp: +86-13682550935 Skype: sales-obd2store@outlook.com http://www.obd2store.com/xtuner-t1-heavy-duty-trucks-scanner-wifi-xtuner-t1-hd-heavy-duty-truck-auto-intelligent-diagnostic-tool-with-v131-xtuner-t1-download-software-p-1705.html …pic.twitter.com/aVQTDzVDNM";;@outlook;#XTUNER;"1146624115710652417";https://twitter.com/OBD2Tuner/status/1146624115710652417
;2019/07/12 13:14;0;0;"TWOW Response: Browse your search intelligent... and most importantly, knows you exist!";;;;"1149653240239099909";https://twitter.com/13thyKingdom/status/1149653240239099909
;2019/07/12 12:30;0;0;"Ultra modern and spacious. The all-new #Ford #Focus. From £169 P|M plus initial rental. Features SYNC 3 - including Apple’s CarPlay and Android Auto - Rear privacy glass and Selectable drive mode. Personal contract hire. Click for t&c's. #carleasinguk #carleasedeals";;;#Ford #Focus #carleasinguk #carleasedeals;"1149642056480018432";https://twitter.com/IntelligentCL/status/1149642056480018432
;2019/07/12 10:50;0;0;"Expert Auto is looking to hire an intelligent employee at an annual salary of 55,750 dollars for a rewarding position at the company.";;;;"1149616909547003905";https://twitter.com/manual_work/status/1149616909547003905
;2019/07/12 09:05;0;0;"BAOPACK is constantly developing intelligent vertical packaging machines. It has innovative packing technology and reliable packing solutions for customers. More?https://www.baopacktech.com/  #autopackagingmachine #foodpackagingequipment #packagingautomationsolutionspic.twitter.com/ohFDxPYPy5";;;#autopackagingmachine #foodpackagingequipment #packagingautomationsolutionspic;"1149590706186420225";https://twitter.com/baopackmachine/status/1149590706186420225
;2019/07/11 15:25;0;0;"Snap-on offers family of Intelligent Diagnostics products http://dlvr.it/R8DBNg ";;;;"1149323734274039809";https://twitter.com/AutoRepairTechs/status/1149323734274039809
;2019/07/11 13:05;0;0;"Ecofresh Smart toilet Auto toilet lid and seat flip integrated automatic intelligent toilet cover wash dry massage https://enuvision.com/products/ecofresh-smart-toilet-auto-toilet-lid-and-seat-flip-integrated-automatic-intelligent-toilet-cover-wash-dry-massage …";;;;"1149288676909674497";https://twitter.com/eNuvision1/status/1149288676909674497
;2019/07/11 08:49;0;0;"We are at the Frost & Sullivan ( @FS_events) Intelligent Mobility Conference today, an interesting agenda and we'll try to post highlights from the event";;@FS_events;;"1149224205961048064";https://twitter.com/AutoRetail/status/1149224205961048064
;2019/07/11 07:41;0;0;"@Uber_India has found a new way of making money. It has asked its drivers to not stop the ride even after dropping the passenger. Got the first taste of this 'intelligent' strategy today. I took an auto for a route of 1.5 km. The fare shown to me was Rs.35. But the driver (1/n)";;@Uber_India;;"1149207121252110336";https://twitter.com/guptanubhav1985/status/1149207121252110336
;2019/07/10 15:33;0;0;""Quality is never an accident. It is always the result of intelligent effort." -John Ruskin -Do you have a favorite quote you would like to share? pic.twitter.com/VvcrjNsC1L";;;;"1148963422765084672";https://twitter.com/AdvGlass/status/1148963422765084672
;2019/07/09 15:42;1;2;"vulnx spider is an intelligent bot auto shell injector that detect vulnerabilities in multiple types of cms { #wordpress , #joomla , #drupal , #prestashop .. }https://github.com/anouarbensaad/vulnx …";;;#wordpress #joomla #drupal #prestashop;"1148603359907188737";https://twitter.com/trasweb/status/1148603359907188737
;2019/07/08 22:01;0;0;"Nutri Ninja Bowl Duo Reviews | Product ItemsNutri Ninja Nutri Bowl Duo is a multi-functional and intelligent blender. Yes, it has unique a unique feature of auto IQ technology that combines timely https://productitems.com/nutri-ninja-duo-reviews/ … pic.twitter.com/wwSULl6KkV";;;;"1148336256671264772";https://twitter.com/productitems/status/1148336256671264772
;2019/07/08 21:09;0;0;"#BusinessSecurity HD 1080P Cloud Wireless IP Camera Intelligent Auto Tracking Home Security Surveillance CCTV https://dgisecuritytech.com/product/cloud-wireless-ip-camera/ …pic.twitter.com/C0cC7F0jlU";;;#BusinessSecurity;"1148323322960273412";https://twitter.com/DGIsecurity/status/1148323322960273412
;2019/07/08 18:12;0;2;"I thought it would be "Error 720 - No intelligent user detected. Auto disconnect in 10 seconds"";;;;"1148278679694381056";https://twitter.com/FAMER4Mixer/status/1148278679694381056
;2019/07/08 01:54;1;1;"Natasha Escobar commercial reel she's in the pixel 2 commercial safe Auto the 360 bed and some other commercials very intelligent young lady dear Hollywood treat her well the real Robert Boscarato Author so awesome https://m.imdb.com/name/nm9276626/ ";;;;"1148032519255797761";https://twitter.com/RobertBoscarat5/status/1148032519255797761
;2019/07/07 05:53;0;0;"JJRC R5 Robot Intelligent Programmable Auto Music Dance RC Robot For Children Smart Watch Follow Gesture Sensor RC Toys Robo https://www.gyoby.com/jjrc-r5-robot-intelligent-programmable-auto-music-dance-rc-robot-for-children-smart-watch-follow-gesture-sensor-rc-toys-robo/ … $75.99 #toysyn #toysfortots #toysthailandpic.twitter.com/ZbddZNSyaq";;;#toysyn #toysfortots #toysthailandpic;"1147730215017336833";https://twitter.com/GyoBy_brand/status/1147730215017336833
;2019/07/06 15:18;0;0;"2019 Honda Pilot: How to Use Intelligent Traction Management http://dlvr.it/R7wPF4  | http://auto24x7.nl  #auto24x7 #auto #videopic.twitter.com/HBKJK2E3Yv";;;#auto24x7 #auto #videopic;"1147510032856018944";https://twitter.com/auto24x7_NL/status/1147510032856018944
;2019/07/04 14:52;1;1;"Rich IM, Codeless platforms, Mobile Apps, Configurable workspaces, Collaboration tools, Bots & IVR, 'Intelligent' self-service, C-Sat, Gamification, Auto call routing, user activity tracking...must have Next Generation requirements.. enjoy, thanks for sharing";;;;"1146778777881628672";https://twitter.com/McKennaTweet/status/1146778777881628672
;2019/07/12 13:00;0;0;"Shindong Dance Shindong prodigy Shindong Multi-talented Shindong intelligent I will make life beautiful for u #SuperJunior #????? #?? @ShinsFriends @SJofficial";;@ShinsFriends @SJofficial;#SuperJunior # #;"1149649830601355269";https://twitter.com/arzdusturiya/status/1149649830601355269
;2019/07/10 23:10;0;0;"INQMEGA HD 1080P Cloud Wireless IP Camera Intelligent Auto Tracking Of Human Home Security Surveillance CCTV Network Wifi Camera https://ecollecxion.co.uk/product/inqmega-hd-1080p-cloud-wireless-ip-camera-intelligent-auto-tracking-of-human-home-security-surveillance-cctv-network-wifi-camera/ …pic.twitter.com/Z9Rgt6iYJB";;;;"1149078468556181504";https://twitter.com/ajeteys/status/1149078468556181504
;2019/07/10 22:37;0;1;"They don't have ones that know it's raining, but they do have cars where the lights automatically come on when the windshield wipers are turned on. For example:https://www.nissan-global.com/EN/TECHNOLOGY/OVERVIEW/smart_auto_headlight_wiper.html …";;;;"1149070064789983232";https://twitter.com/JasonABowman/status/1149070064789983232
;2019/07/09 17:51;0;0;"Damn you auto correct! At least people are intelligent enough to know what it was supposed to say!!";;;;"1148635699962359809";https://twitter.com/HBeekeeper/status/1148635699962359809
;2019/07/09 17:44;0;0;"Samsung ST72 camera F2.5, 25mm, 5X Zoom Lens / 16.2 Mega Pixels HD Movie Recording (720p, 30fps, MPEG) Live Panorama Smart Auto 3.0"(75mm) Intelligent LCD Comes with original box, brand new Samsung charger,... https://www.facebook.com/100005745401703/posts/1147977252070444/ …";;;;"1148634046492237826";https://twitter.com/leannejones05/status/1148634046492237826
;2019/07/09 13:20;0;0;"Colonial Auto Center is looking to hire an intelligent employee at an annual salary of 52,500 dollars for an invaluable position at the company.";;;;"1148567496011788289";https://twitter.com/manual_work/status/1148567496011788289
;2019/07/09 04:13;0;0;"Apparel Making Association Hongkong invite Richpeace software technician to present a class about Intelligent pattern making and auto cut plan system in 20th July! #richpeace #richpeacecad #agilecrown #fashionsewing… https://www.instagram.com/p/BzrjXM-hEY_/?igshid=8ge89bqps2hu …";;;#richpeace #richpeacecad #agilecrown #fashionsewing;"1148430027811278850";https://twitter.com/JadyHou/status/1148430027811278850
;2019/07/08 17:24;0;1;"My modest proposal was to add semver ranges and/or branches to the .gitmodules metadata for each submodule so that an intelligent UX could know how to auto-update the submodule hashes. It is a backwards compatible change to the data structure but adds desperately needed context.";;;;"1148266701806604288";https://twitter.com/creationix/status/1148266701806604288
;2019/07/07 18:19;0;2;"Windows 10 users might want to block 2 services that are data hogs: Delivery Optimization and BITS (Background Intelligent Transfer Service). Android users should check Auto Updates and turn it off. Could be one of the reasons your data don't last long";;;;"1147918176853909504";https://twitter.com/buildmypcng/status/1147918176853909504
;2019/07/07 11:45;0;2;"Non-GMO? Auto-correct is so Intelligent! Should be Non-ML";;;;"1147818963855970304";https://twitter.com/Bill_Matthews/status/1147818963855970304
;2019/07/04 23:16;0;0;"See our latest #NiagaraFalls, NY #Automotive job opportunity and click the link in our bio to apply: Mechanics at Remedy Intelligent Staffing";;;#NiagaraFalls #Automotive;"1146905751815778305";https://twitter.com/tmj_NY_auto/status/1146905751815778305
;2019/07/04 18:30;0;0;"ETAuto | Baidu partners with Geely for intelligent mobility solutions http://auto.economictimes.indiatimes.com/news/industry/baidu-partners-with-geely-for-intelligent-mobility-solutions/70074401 …";;;;"1146833573896282113";https://twitter.com/ETAuto/status/1146833573896282113
;2019/07/08 21:22;0;3;"Great to see intelligent economic policy instead of deficit spending for govt hires in order to hide failures of socialist policy. Making Canada attractive for business is vital, or there’s no jobs at all Ask Ontario auto workers if tax cuts for corps make sense. Oops, too late";;;;"1148326399138250752";https://twitter.com/Yukon_Strong/status/1148326399138250752
;2019/07/08 19:20;0;0;"Colonial Auto Center is looking to hire an intelligent employee at an annual salary of 62,000 dollars for an influential position at the company.";;;;"1148295702029721601";https://twitter.com/manual_work/status/1148295702029721601
;2019/07/08 14:17;0;0;"9. Intelligent tire pressure monitors 10. IsoFix for car seats 11. Auto wipers 12. Heated windshields 13. ABS & traction control 14. Telescopic steering 15. Dual climate zones. And that’s just off the top of my head ... /2";;;;"1148219557858992128";https://twitter.com/fizzyjam/status/1148219557858992128
;2019/07/07 00:28;0;0;"For exemple when i want to write the word "is" my auto Always write it w/ capslock because of IS being intelligent system xD";;;;"1147648485669396480";https://twitter.com/zeschire/status/1147648485669396480
;2019/07/06 12:46;0;0;"@lvmfi @Trafi_FinlandOur quest is to make Finland the foremost destination for home grown AI, intelligent transport solutions. AI.Pilot is our contribution. Maybe someday we will have a European answer to Google etc. @FCAI_fi @hsfi @ERTICO @HBH_HQ @MinnaLampinen @BusinessFinland";;@lvmfi @Trafi_FinlandOur @FCAI_fi @hsfi @ERTICO @HBH_HQ @MinnaLampinen @BusinessFinland;;"1147471908595806209";https://twitter.com/thirdspaceauto/status/1147471908595806209
;2019/07/05 20:52;0;0;"Cool story. I too am a "history major" on the internet. It's been fun having an intellectual discussion with you. Sadly, the intelligent part wasn't on your side, but perhaps another time. pic.twitter.com/0ZxtBk6wKB";;;;"1147231891273027585";https://twitter.com/LyssaAutoMagic/status/1147231891273027585
;2019/07/05 17:30;0;0;"German insurer bids for Brazilian firm’s auto and P&C portfolio. Brazilian insurance market has grown in recent years but market penetration is low compared to the rest of the world. https://www.intelligentinsurer.com/news/allianz-se-makes-bid-for-brazilian-sul-america-s-auto-and-p-c-portfolio-18664 … #Brazil #insurance #Germany";;;#Brazil #insurance #Germany;"1147180990684700674";https://twitter.com/intelligentins/status/1147180990684700674
;2019/07/05 16:56;0;1;"Thanks for your feedback on this. The Excel grade features heated retractable mirrors, reversing camera, lane departure alert, road sign assist, heated seats and intelligent adaptive cruise control. We are currently looking into the possibility of Android Auto. Thanks.";;;;"1147172390151102467";https://twitter.com/ToyotaUK/status/1147172390151102467
;2019/07/04 18:13;0;0;"I just listed: 'UKPlus 1080P Cloud Wireless IP Camera Intelligent Auto Tracking Of Human Hom...', for 115 via @amazonhttp://www.amazon.ae/gp/product/B07SGMZZRL/ref=cm_sw_r_tw_myi?m=A3MGPMPGQPQNQ5 …";;@amazonhttp;;"1146829286705438720";https://twitter.com/UkplusDubai/status/1146829286705438720
;2019/07/04 17:42;2;1;"Geely: Baidu partners with Geely for intelligent mobility solutions, Auto News,... http://bit.ly/2xwHWoy  #autonomousCar #selfDrivingCar";;;#autonomousCar #selfDrivingCar;"1146821572331806721";https://twitter.com/SelfDrivingFEED/status/1146821572331806721
;2019/07/03 21:40;0;0;"Remedy Intelligent Staffing is hiring in #Westerville, OH! Read about our latest #Automotive job opening via the link in our bio: AutoCad Entry Level Design/Drafter and Sr. Designer Full Time Direct Hire Westerville";;;#Westerville #Automotive;"1146519072059736064";https://twitter.com/tmj_OH_auto/status/1146519072059736064
;2019/07/03 19:50;0;0;"AMY Robot is a service robot with three basic features: intelligent voice interaction with humans, auto-navigation with obstacle avoidance and applications developable with SDK/API documents. https://ozrobotics.com/shop/amy-robot/#.XRz4y_9lFNE.twitter …";;;#;"1146491397933096962";https://twitter.com/OzRoboticsUSA/status/1146491397933096962
;2019/07/08 10:22;3;12;"https://www.kitploit.com/2019/06/vulnx-v17-intelligent-bot-auto-shell.html?m=1 …";;;;"1148160337163763712";https://twitter.com/SdAbaddon/status/1148160337163763712
;2019/07/07 21:21;0;0;"Ne riez pas : ce n’est pas drôle, c’est subtilement intelligent, nuance";;;;"1147963801419091968";https://twitter.com/cathAuto/status/1147963801419091968
;2019/07/07 16:35;0;0;"1980: En el futuro habrán autos que vuelan! 2019: Se ofenden y lloran porque ponen un helicóptero en un juego. Vamos de mal en peor eh, esto me ofende ay se me cayeron mis privilegios";;;;"1147891820728389632";https://twitter.com/Jack15004/status/1147891820728389632
;2019/07/07 15:51;0;0;"https://direct-drones.com/s70w-intelligent-gps-car-follow-drone-remote-control-quadcopter-fixed-height-positioning-auto-return-dual-camera-a …...";;;;"1147880741608546305";https://twitter.com/directdronescom/status/1147880741608546305
;2019/07/07 08:43;0;0;"Wer "das Auto", Hitlers Steckenpferd, für Kultur hält, hält sich selber wohl gar für intelligent oder relevant? #lindner";;;#lindner;"1147773001133436928";https://twitter.com/GiletsjaunesHH/status/1147773001133436928
;2019/07/07 00:50;0;0;"Central Body Auto Repair is looking to hire an intelligent employee at an annual salary of 62,250 dollars for a successful position at the company.";;;;"1147653973693915136";https://twitter.com/manual_work/status/1147653973693915136
;2019/07/06 22:09;0;0;"So ist es. #Elektroauto mit #Ökostrom am Arbeitsplatz intelligent und gesteuert laden. So hat man abends stets ein vollgeladenes Auto und keine Abgase in der Stadt. Oder gleich den elektrischen ÖPNV nehmen.";;;#Elektroauto #;"1147613549528850434";https://twitter.com/holgor/status/1147613549528850434
;2019/07/06 15:02;0;0;"ÖPNV muss man intelligent fördern. Viele kleine, billige Busse sind oft VIEL besser als große oder als Pkws. In Asien fahren sie dort, wo Kunden sind im Hopp-on-hopp-off-Betrieb, sind billig und emissionsarm. H2-Autos mit Überlastwindstrom wären bei polit. Willen schon Realität.";;;;"1147506198125666304";https://twitter.com/DrNiemitz/status/1147506198125666304
;2019/07/06 08:57;0;0;"oui bé allors on a pas tous la chance d avoir un correcteur auto intelligent !";;;;"1147414374828691456";https://twitter.com/letroodonquial1/status/1147414374828691456
;2019/07/06 01:17;0;1;"I got the same problem. I guess we need to correct the auto correct cause technology. Lol it's gonna take over the world, shoot I hope them robots have intelligent programmers.";;;;"1147298365350170624";https://twitter.com/Farmgal2010/status/1147298365350170624
;2019/07/06 00:05;0;1;"Actually body cams have been turned against us already. Auto face recognition is being used to target POC because the software isn't intelligent enough to tell the difference between on black man from another. Not saying that's why she was against them Just saying picture is big";;;;"1147280395857289217";https://twitter.com/RRN3/status/1147280395857289217
;2019/07/05 15:35;0;0;"#BonPlan #airpur Levoit Purificateur d’Air LV-pur131 Véritable HEPA &Filtre Charbon Actif, 4 Niveaux de Filtration Allergène Poussière, Tabac, Capteur Auto Intelligent, Grande Surface(32 m²) [Classe A+++] à 144.49€ https://amzn.to/2PDdVf2  http://techvorace.com/bonplans/rubrique-bons-plans/ …pic.twitter.com/fdvnLJotSQ";;;#BonPlan #airpur;"1147152016441036805";https://twitter.com/techvorace/status/1147152016441036805
;2019/07/05 14:29;3;33;"Ah oui la team les AirPods c’est génial mais au volant essayer d’être un minimum intelligent et retirez les. Mettez plutôt la musique sur l’auto radio c’est vraiment plus safe https://twitter.com/NexusLithium/status/1147090707699642368 …";;;;"1147135408830111745";https://twitter.com/AirPodsFC/status/1147135408830111745
;2019/07/05 12:35;0;0;"German insurer bids for Brazilian firm’s auto and P&C portfolio. Brazilian insurance market has grown in recent years but market penetration is low compared to the rest of the world. https://www.intelligentinsurer.com/news/allianz-se-makes-bid-for-brazilian-sul-america-s-auto-and-p-c-portfolio-18664 … #Brazil #insurance #Germany";;;#Brazil #insurance #Germany;"1147106636202487808";https://twitter.com/intelligentins/status/1147106636202487808
;2019/07/04 20:35;0;1;"Baidu partners with Geely for intelligent mobility solutions | ET Auto https://auto.economictimes.indiatimes.com/news/industry/baidu-partners-with-geely-for-intelligent-mobility-solutions/70074401 …";;;;"1146865045181280262";https://twitter.com/VPiparsania/status/1146865045181280262
;2019/07/04 16:54;0;0;"Beckhoff Unveils Intelligent Transport Technology http://dlvr.it/R7phyT pic.twitter.com/dZdbiPSHJL";;;;"1146809539653541889";https://twitter.com/MarketAutoTools/status/1146809539653541889
