username;date;retweets;favorites;text;geo;mentions;hashtags;id;permalink
;2017/05/21 10:32;21;19;"Top 10 Artificial Intelligence Companies to Watch in #Transportation http://klou.tt/1cgxpk9vobmi7  #AI #ArtificialIntelligence";;;#Transportation #AI #ArtificialIntelligence;"866225162185846784";https://twitter.com/jose_garde/status/866225162185846784
;2017/05/05 06:55;22;18;""The impact of artificial intelligence in transportation" http://blog.willis.com/2017/05/the-impact-of-artificial-intelligence-in-transportation/ … #ArtificialIntelligence #AI #transportation";;;#ArtificialIntelligence #AI #transportation;"860372278550429696";https://twitter.com/jose_garde/status/860372278550429696
;2017/04/23 18:52;5;9;"At #AutoShanghai we show you how #ZF & @nvidia are bringing artificial intelligence to the #transportation industry. http://bit.ly/2kSdZtG pic.twitter.com/0fiJBpMZKL";;@nvidia;#AutoShanghai #ZF #transportation;"856204023174770688";https://twitter.com/ZF_Group/status/856204023174770688
;2017/04/13 17:46;19;17;"How Artificial Intelligence Can Make Public Transportation Safer http://blog.paralleldots.com/technology/artificial-intelligence-can-make-public-transportation-safer/ … #ArtificialIntelligence #AI";;;#ArtificialIntelligence #AI;"852563746782408704";https://twitter.com/jose_garde/status/852563746782408704
;2017/03/26 22:00;44;56;"Electricity changed transportation, manufacturing, healthcare & more. Artificial intelligence is set to do the same. http://stanford.io/2ng4IuV ";;;;"846104471591702528";https://twitter.com/StanfordGSB/status/846104471591702528
;2017/03/18 16:05;6;15;"Artificial Intelligence, evolution BUT revolution on jobs, health & transportation! http://bit.ly/revoai  #AI #innovation #Transhumanismpic.twitter.com/jrzHoyC3ky";;;#AI #innovation #Transhumanismpic;"843131237141172224";https://twitter.com/Matt_Dejardins/status/843131237141172224
;2016/11/17 23:30;25;75;"Artificial Intelligence is powering a new world of automation in energy, industrial, and of course transportation. #IntelAIpic.twitter.com/UNePHk3qxh";;;#IntelAIpic;"799394230426890245";https://twitter.com/IntelBusiness/status/799394230426890245
;2016/09/30 18:55;12;6;"Smart Transportation To Be Managed By Artificial Intelligence Systems And Cloud Services http://ow.ly/bn6f304JsoI ";;;;"781915296768589824";https://twitter.com/DataScienceCtrl/status/781915296768589824
;2016/09/29 18:10;21;7;""Artificial Intelligence will revolutionize transportation, #healthcare and society." - @JimMcHugh #StrataHadoop #AI #healthITpic.twitter.com/RWhu0t9AjQ";;@JimMcHugh;#healthcare #StrataHadoop #AI #healthITpic;"781541784241537024";https://twitter.com/INFA_BD/status/781541784241537024
;2016/07/30 00:58;6;1;"Self-Driving Pods Could Be The Future Of Public Transportation http://bit.ly/2a6cOD0  #AI #robotics | artificial intelligence";;;#AI #robotics;"759176394450595840";https://twitter.com/ai_briefing/status/759176394450595840
;2016/06/14 18:10;8;8;"Can Artificial Intelligence Software Transform Transportation? FDOT CIO April Blackburn explains. http://www.govtech.com/computing/Can-Artificial-Intelligence-Software-Transform-Transportation.html …";;;;"742766281951219713";https://twitter.com/FDOT_Secretary/status/742766281951219713
;2015/10/24 15:18;20;38;"1. 3D printing companies 2. Artificial Intelligence companies 3. Bitcoin companies 4. Connected transportation pic.twitter.com/BZO0V3R2j5";;;;"657924097968590852";https://twitter.com/ValaAfshar/status/657924097968590852
;2015/10/22 02:17;29;35;"1. 3D printing companies 2. Artificial Intelligence companies 3. Bitcoin companies 4. Connected transportation pic.twitter.com/DFgoqt3yvx";;;;"657002784764645376";https://twitter.com/ValaAfshar/status/657002784764645376
;2015/05/28 10:44;0;1;"Two mind-boggling topics at #Pioneers15 - Artificial Intelligence and green transportation with #hyperloop";;;#Pioneers15 #hyperloop;"603859410868424704";https://twitter.com/clientchamp/status/603859410868424704
;2015/04/21 15:22;0;0;"#AI Salima Mnif of Université de Tunis, Tunis with expertise in Immunology, Artificial Intelligence, Transportation… http://goo.gl/fb/0woQSm ";;;#AI;"590521114167771137";https://twitter.com/AI_Today/status/590521114167771137
;2015/03/17 23:05;0;3;"It's a wrap #SXSW2015 highlights: Artificial intelligence, the future of transportation & evolution of media. I'm ready for my mind clone.";;;#SXSW2015;"577969151857168384";https://twitter.com/fjstaub/status/577969151857168384
;2015/01/17 18:24;1;1;"Between artificial intelligence, high-speed transportation and reusable rockets, Elon Musk has had a very busy week. https://amp.twimg.com/v/36570ed7-4926-4d81-aae0-e3bc8d201531 …";;;;"556517540021555201";https://twitter.com/Newsy/status/556517540021555201
;2015/01/16 20:37;0;0;"How will artificial intelligence effect the transportation and logistics industry?... http://fb.me/2W293KcUk ";;;;"556188611054698496";https://twitter.com/IntelliTrack/status/556188611054698496
;2014/10/22 08:03;0;0;"BRS Labs to Bring Ground Breaking Artificial Intelligence Analytics to AAPA’s 103rd… http://dlvr.it/7H8TL2  #transportation #transportation";;;#transportation #transportation;"524818208696434688";https://twitter.com/dlvr_transport/status/524818208696434688
;2014/09/17 22:20;1;0;"How do I relate artificial intelligence with operational research while dealing with a transportation …: Answe... http://bit.ly/1wECSsK ";;;;"512350413396246528";https://twitter.com/_ai_tweet_/status/512350413396246528
;2014/09/04 15:02;0;0;"MARTA software uses artificial intelligence to identify security problems #transportation http://ow.ly/B5cvq ";;;#transportation;"507529097250340864";https://twitter.com/pulsarad/status/507529097250340864
;2014/08/28 08:09;0;0;"City of Atlanta’s MARTA Selects BRS Labs as Provider of Artificial Intelligence... http://dlvr.it/6l9yh6  #transportation #transportation";;;#transportation #transportation;"504888447694163968";https://twitter.com/dlvr_transport/status/504888447694163968
;2014/07/06 20:40;0;1;"Practical application of Artificial Intelligence in Hong Kong: public transportation and visa applications. http://fb.me/33tE24w7o ";;;;"485870999171133440";https://twitter.com/Superplex/status/485870999171133440
