username;date;retweets;favorites;text;geo;mentions;hashtags;id;permalink
;2019/07/04 04:54;0;0;"Chinese Internet giant Baidu and Zhejiang Geely Holding Group (Geely Holding) forged a partnership on July 3 at the Baidu Create 2019.http://autonews.gasgoo.com/china_news/70016115.html …";;;;"1146628216179712001";https://twitter.com/xoudan180/status/1146628216179712001
;2019/07/03 19:45;0;0;""Bueno ahora si entren al auto, están arrestados"";;;;"1146490248412770305";https://twitter.com/Jack15004/status/1146490248412770305
;2019/07/05 21:50;0;0;"INQMEGA HD 1080P Cloud Wireless IP Camera Intelligent Auto Tracking Of H... https://youtu.be/Yc1w1j_85cU  vía @YouTube";;@YouTube;;"1147246330626084864";https://twitter.com/jcjohnsonv/status/1147246330626084864
;2019/07/05 14:40;0;0;"????? ??????? ???????/ Oddworld: Abe’s Oddysee Cool Boarders 2 Destruction Derby Final Fantasy VII Grand Theft Auto Intelligent Qube Jumping Flash! Metal Gear Solid Mr. Driller Battle Arena Toshinden Rayman Resident Evil Director’s Cut Revelations: Persona R4 Ridge Racer Type 4";;;;"1147138213754093568";https://twitter.com/AalamTech/status/1147138213754093568
;2019/07/05 13:52;0;2;"C'est fatigant cette façon de donner des ordres en se pensant intelligent.";;;;"1147126039149240320";https://twitter.com/MarieFernet/status/1147126039149240320
;2019/07/05 13:03;1;1;"Baidu partners with Geely for intelligent mobility solutions #SmartCity #Baidu #Geely #mobilityhttps://auto.economictimes.indiatimes.com/news/industry/baidu-partners-with-geely-for-intelligent-mobility-solutions/70074401 …";;;#SmartCity #Baidu #Geely #mobilityhttps;"1147113650924244992";https://twitter.com/ashishrbedekar/status/1147113650924244992
;2019/07/05 06:20;0;0;"Honest One Auto Care is looking to hire an intelligent employee at an annual salary of 64,000 dollars for a successful position at the company.";;;;"1147012245349703685";https://twitter.com/manual_work/status/1147012245349703685
;2019/07/04 22:46;0;0;"Are you saying that intelligent people don’t have to keep telling others how smart the are?";;;;"1146898085777293312";https://twitter.com/BansheeAutoPart/status/1146898085777293312
;2019/07/04 07:56;0;1;"Pose d'un chauffe-eau ultra plat Atlantic Lineo. Le chauffe-eau intelligent pilotable à distance et économique grâce au mode AUTO qui s’adapte automatiquement à vos besoins ! #plombier #chauffagiste #btp #hauteloire #atlantic #auvergnepic.twitter.com/eqsp95xri9";;;#plombier #chauffagiste #btp #hauteloire #atlantic #auvergnepic;"1146674156202856448";https://twitter.com/OV_Plomberie/status/1146674156202856448
;2019/07/04 07:44;0;0;"Wieder ein äußerst intelligent zu sein glaubender Nazi, der Nationalsozialismus mit Sozialismus gleichsetzt. Aber mit solchen Menschen kann man nicht Diskutieren, Autos sind ja mehr wert als Ausländer.";;;;"1146671169124413440";https://twitter.com/DFGera/status/1146671169124413440
;2019/07/04 04:44;0;0;"If our president really cared about our servicemen and women he would care more about their safety and improve the VA system and not try to privatize it! Our military deserves intelligent leadership, support, and not be a presidential tool, at home or abroad!";;;;"1146625758988627968";https://twitter.com/BansheeAutoPart/status/1146625758988627968
;2019/07/04 01:37;0;1;"Maybe you should have thought of that first? There is such a thing as pre planning! Shooting from the hip is not the intelligent way to operate!";;;;"1146578769261387777";https://twitter.com/BansheeAutoPart/status/1146578769261387777
;2019/07/03 17:27;0;0;"Oui oui vous entendez bien. Te mansplain ta propre auto-analyse. En ajoutant zéro info Je sais pas ça doit les frustrer que je devienne quelqu'un d'hyper sage et intelligent";;;;"1146455407948378113";https://twitter.com/kidordean/status/1146455407948378113
;2019/07/03 15:21;4;12;"Topper, Scholar, Intelligent, Genius, Fir aate hain wo log jo "Bus stop, Platform, Train, Bus, Auto me kitab khol kar padhte hai.... #JustForFun #MamtaTalks.pic.twitter.com/GcwM0aGBJS";;;#JustForFun #MamtaTalks;"1146423616109551616";https://twitter.com/MamtaParmar19/status/1146423616109551616
;2019/06/29 15:12;46;101;"VulnX v1.7 - An Intelligent Bot Auto Shell Injector That Detect Vulnerabilities In Multiple Types Of CMS http://j.mp/2XDQ8lt  #VulnXpic.twitter.com/b0eXc4H6eC";;;#VulnXpic;"1144972026228203523";https://twitter.com/KitPloit/status/1144972026228203523
;2019/05/28 13:16;24;279;"#Eindhoven @gem_Eindhoven Mayor John Jorritsma @JJorritsma040 & I talked abt the potential market for electric car &bus & auto car in #Taiwan. I'll send my staff to the Intelligent Transport Systems World Congress @ITS_Singapore to get more info. Thanks @guywittich & @NTIO_Taiwanpic.twitter.com/tmIUHXcteJ";;@gem_Eindhoven @JJorritsma040 @ITS_Singapore @guywittich @NTIO_Taiwanpic;#Eindhoven #Taiwan;"1133346276349603840";https://twitter.com/KP_Taipei/status/1133346276349603840
;2019/05/27 15:16;46;97;"VulnX - CMS And Vulnerabilites Detector And An Intelligent Auto Shell Injector http://j.mp/2EAk1bM  #Bruteforcer #CMS #CommandLinepic.twitter.com/nfx1WlX65J";;;#Bruteforcer #CMS #CommandLinepic;"1133014140895805440";https://twitter.com/KitPloit/status/1133014140895805440
;2019/05/24 21:24;16;33;"VulnX - Cms And Vulnerabilites Detector And An Intelligent Auto Shell Injector:- Detect cms (wordpress, joomla, prestashop, drupal, opencart, magento, lokomedia) Target Subdomains. Checks for vulnerabilites. Auto shell injector. Exploit dork searcher. https://github.com/anouarbensaad/vulnx …pic.twitter.com/IzW6v9UBie";;;;"1132019631554801666";https://twitter.com/Alra3ees/status/1132019631554801666
;2019/05/05 06:48;16;100;""It's not the strongest of the species that survives, not the most intelligent, but the one most responsive to change" ~ Charles Darwin. Applicable to : • Healthcare industry. • IT & Technology. • Auto Ancillaries etc., Insight : @unseenvalue #EQT_learnings";;@unseenvalue;#EQT_learnings;"1124913692162830336";https://twitter.com/Vivek_Investor/status/1124913692162830336
;2019/04/19 07:56;19;75;"NIO Cloud is an intelligent power network that connects power swap stations, mobile charging vehicles, user EVs and service teams, to enable flexible deployment of our One Click for Power solution. The Cloud will be on display at NIO House Auto Shanghai throughout the week pic.twitter.com/w4xM7DxGkw";;;;"1119132535605190656";https://twitter.com/NIOGlobal/status/1119132535605190656
;2019/04/12 16:50;9;21;"White Supremist, racist -the new argument against an opposing position. It doesn’t require intelligent thought; just put the brain on auto-pilot and you are a winner by sheer intimidation. #PPC2019 #BernierNationhttps://twitter.com/Perkster28/status/1116572771893440514 …";;;#PPC2019 #BernierNationhttps;"1116730191886213120";https://twitter.com/inmyviewandmore/status/1116730191886213120
;2019/04/06 18:16;20;35;"Before #AI: Oil field technicians manually prepare a drill, then calculate and enter the correct pressure and speed for that drill. With #AI: Intelligent drills auto calculate speed, pressure, and depth. That's just the beginning says @pauldaugh: https://sforce.co/2TXdzQV pic.twitter.com/h5jc9I9HOh";;@pauldaugh;#AI #AI;"1114577587689459720";https://twitter.com/salesforce/status/1114577587689459720
;2019/03/28 18:20;5;18;"I am an auto-didact, my friend...I ran away from college to join the circus. I learned most of what I know on my own through observing as well as reading voraciously and associating with intelligent people whenever possible. Living well is an education. https://twitter.com/bezzarguy1/status/1111330859901042693 …";;;;"1111332177789288449";https://twitter.com/RCdeWinter/status/1111332177789288449
;2019/03/27 07:50;5;10;"Good to see Intelligent Speed Assistance & EU vehicle safety standards lead story by @GraemePaton in @thetimes. Rare for major auto regulations to be reported at all. Important to note, there have been 2 years public debate on these measures by EU Commission/Council/Parliament. pic.twitter.com/x8aZ12xdXD";;@GraemePaton @thetimes;;"1110811217159995394";https://twitter.com/DavidDjward/status/1110811217159995394
;2019/03/26 07:36;17;37;"Great to hear that EU has reached preliminary agreement on new vehicle safety measures, including Auto Emergency Braking & Intelligent Speed Assistance. To be applied from 2021 will avoid 25,000 deaths & 140,000 serious injuries by 2038. Congrats @ETSC_EU on your advocacy effort!pic.twitter.com/cMzQmj0IsF";;@ETSC_EU;;"1110445384999075840";https://twitter.com/DavidDjward/status/1110445384999075840
;2019/03/16 04:14;65;132;"Lahore AbdulHakeem Motorway M3will be opened for traffic on30th March2019which will have an Auto speed camera detection system Intelligent Transport System key features are Weather Information System,Motorway Advisory Radio,Electronic Toll Collection System,Smart Travelling cards pic.twitter.com/DkA3viBe2T";;;;"1106770581905645574";https://twitter.com/Malikji1850/status/1106770581905645574
;2019/03/09 15:15;6;59;"Intelligent Transport System key features are Weather Information System Motorway Advisory Radio Electronic Toll Collection System Smart Travelling cards Mobile app & website connectivity auto accident/incident reporting Electronic Message Signs/Boards complete motorway CCTV";;;;"1104400244194848769";https://twitter.com/DevelopmentPk/status/1104400244194848769
;2019/03/09 15:15;33;164;"Intelligent Transport System(ITS) for 230 Km #Lahore #AbdulHakeem Motorway M-3 ready for opertional in March 2019. 200 Speed checking cameras installed. The newly constructed Lahore-Abdul Hakeem Motorway has an Auto speed camera detection system. pic.twitter.com/FWTyGYhiAL";;;#Lahore #AbdulHakeem;"1104400237496545280";https://twitter.com/DevelopmentPk/status/1104400237496545280
;2019/02/27 15:23;10;78;"I love the First-in-class #8InchTouchscreen in the intelligent new #NissanKicks. With wow functionality like Speed Sensing Auto Volume Control, Android Auto and Apple CarPlay #MadeOfMyStuff";;;#8InchTouchscreen #NissanKicks #MadeOfMyStuff;"1100778481699508229";https://twitter.com/SirJadeja/status/1100778481699508229
;2019/02/06 03:29;4;64;"Smart dual mode speed controls are both simple and robust with no need for additional software. Both fan and pump speeds can be managed by an intelligent auto mode or switched to PWM mode for precise user control. http://www.fractal-design.com/home/product/water-cooling …pic.twitter.com/WUU5avSWqJ";;;;"1092988604954091520";https://twitter.com/FractalDesignNA/status/1092988604954091520
;2019/01/10 19:24;14;26;"Great post from @marypcbuk on @CIOonline on the need to automate EVERYTHING! We agree & have been working hard to automate PC deployment -> Auto Pilot, Windows deployment/upgrade -> Desktop Analytics, & intelligent security -> Intelligent Security Graph. https://www.cio.com/article/3332024/it-strategy/7-things-it-should-be-automating.html …";;@marypcbuk @CIOonline;;"1083444567343390720";https://twitter.com/Anderson/status/1083444567343390720
;2018/12/29 00:04;2;22;"ever type from your left hand while lying on the side and end up typing axstricbxka instead of australia and then wish your auto correct was artificially intelligent enough to fekin get it on its own because you're too comfortable in that position to shift it to your right hand?";;;;"1078804026949595139";https://twitter.com/5odayja/status/1078804026949595139
;2018/11/28 15:00;8;13;"Looking forward to speaking tomorrow in @EuropeanParl workshop on EU vehicle safety with @rozathun MEP. Will be supporting Commission proposals for mandatory Auto Emergency Braking & Intelligent Speed Assistance which can help to halve road deaths & serious injuries #50by30.pic.twitter.com/XApvtwEvDn";;@EuropeanParl @rozathun;#50by30;"1067795359160811520";https://twitter.com/DavidDjward/status/1067795359160811520
;2018/11/26 14:21;310;95;"S3 Intelligent-Tiering is the 1st cloud storage class to deliver cost savings by auto-tiering objects between 2 storage tiers–frequent access & infrequent access–as access patterns change. #reInvent https://amzn.to/2TLzknR  pic.twitter.com/66Az8OUijT";;;#reInvent;"1067060714911793153";https://twitter.com/awscloud/status/1067060714911793153
;2018/11/24 23:02;10;32;"See how easy it is to capture high-quality flash images with the Canon Speedlite 470EX-AI Flash. It is the world's first flash with Auto Intelligent (AI) Bounce technology, allowing you to bounce like a pro, even if you are new to flash photography. #bouncelikeapropic.twitter.com/M0nwEm30nT";;;#bouncelikeapropic;"1066467147512233984";https://twitter.com/CanonUSAimaging/status/1066467147512233984
;2018/11/13 13:45;3;30;"One of our @MarubeniKomatsu PC210i’s taking Intelligent Machine Control to the next level with an Auto-Tilt bucket. This allows us to change the bucket angle in real time to match the design surface, giving us greater flexibility and allowing for complex surface designs #GPSpic.twitter.com/7h8vQ8nWIG";;@MarubeniKomatsu;#GPSpic;"1062340668029313025";https://twitter.com/dmorganplc/status/1062340668029313025
;2018/11/13 09:59;10;19;"Delighted to support @ETSC_EU #LastNightTheEUSavedMyLife campaign. We need mandatory Intelligent Speed Assistance, Auto Emergency Braking, & Safer Car/Lorry fronts for pedestrians. No reason for delay - time to act now #4RoadSafety.pic.twitter.com/DwtGn6kVMw";;@ETSC_EU;#LastNightTheEUSavedMyLife #4RoadSafety;"1062283777559408640";https://twitter.com/DavidDjward/status/1062283777559408640
;2018/10/29 12:41;56;201;"The full #PlayStationClassic 20 game line-up [1/2] Battle Arena Toshinden Cool Boarders 2 Destruction Derby Final Fantasy VII Grand Theft Auto Intelligent Qube Jumping Flash Metal Gear Solid Mr Driller Oddworld: Abe’s Oddysee";;;#PlayStationClassic;"1056888767649325056";https://twitter.com/PlayStationUK/status/1056888767649325056
;2018/10/24 17:01;6;11;"Whether you're gas or electric, we agree with @ITS_America, @auto_alliance, @GloblAutomkrs, @5GAA_official, & @aashtospeaks that 5.9 GHz spectrum is fueling the safety ecosystem for autonomous vehicles & intelligent transportation https://blogs.cisco.com/gov/fueled-by-spectrum-a-fast-growing-safety-ecosystem-for-autonomous-vehicles-intelligent-transportation …";;@ITS_America @auto_alliance @GloblAutomkrs @5GAA_official @aashtospeaks;;"1055127153321406464";https://twitter.com/CiscoPubPolicy/status/1055127153321406464
;2018/10/13 22:48;4;27;"Our obsession with the apocalypse in mainstream arts stems from the underlying presumption that humanity is likely to eventually auto-destruct. Although it might seem likely, I doubt that this would ever happen. Remember, we are too numerous and intelligent, an apex predator. pic.twitter.com/ScSPTtlawL";;;;"1051228177358569472";https://twitter.com/sanyal_poulomi/status/1051228177358569472
;2018/10/04 20:01;36;134;"A new video from Jeremy (Blue Collar Crypto). It covers the latest updates from #MATRIXAINetwork, including #MATRIX #testnet, auto-coding Intelligent Contracts, Digital Asset Safe ( #DAS) and #dApp. #SmartContracts #AI #Blockchain $MANhttps://www.youtube.com/watch?v=UYbQbC59D6s&t=28s …";;;#MATRIXAINetwork #MATRIX #testnet #DAS #dApp #SmartContracts #AI #Blockchain;"1047924617598435328";https://twitter.com/MatrixAINetwork/status/1047924617598435328
;2018/09/16 19:15;5;24;"Matrix introducing auto-coding intelligent contracts How? 1. Semantic Analysis Engine 2. Secure Virtual Machine Very bullish on $MAN and @MatrixAINetwork http://medium.com/@matrixainetwork/the-matrix-semantic-analysis-engine-introducing-intelligent-contracts-7b2bb588f77 …pic.twitter.com/xnerJXKH0b";;@MatrixAINetwork @matrixainetwork;;"1041390186314309634";https://twitter.com/dbcryptoteam/status/1041390186314309634
;2018/09/14 00:53;8;13;"#WinWithAI In the future, data itself will be intelligent - #AI auto-building models, insights, and features without needing explicit systems. @dineshknirmal #IBMChampion @IBManalytics @IBMCloudPrivatepic.twitter.com/Ol2uny7uUK";;@dineshknirmal @IBManalytics @IBMCloudPrivatepic;#WinWithAI #AI #IBMChampion;"1040388003976413184";https://twitter.com/cspenn/status/1040388003976413184
;2018/09/13 17:26;16;56;"Happy #NationalDriveElectricWeek! #FaradayFuture was born to protect the earth's ecology, address traffic issues, disrupt the auto industry and create the future intelligent shared mobility ecosystem. Read about our mission here: https://ev.ff.com/2MqdZvl . #FF91 #EV #NDEW2018pic.twitter.com/ufI77tInQt";;;#NationalDriveElectricWeek #FaradayFuture #FF91 #EV #NDEW2018pic;"1040275574688768001";https://twitter.com/FaradayFuture/status/1040275574688768001
;2018/09/05 18:50;4;45;"Smart dual mode speed controls are both simple and robust with no need for additional software. Both fan and pump speeds can be managed by an intelligent auto mode or switched to PWM mode for precise user control. Learn more about this on our website: http://www.fractal-design.com/home/product/water-cooling …pic.twitter.com/nzdEnMARgX";;;;"1037397497067565056";https://twitter.com/FractalDesignNA/status/1037397497067565056
;2018/07/04 18:39;12;29;"BREAKING NEWS: The new #Sprinter: the most intelligent, powerfully connected van the world has ever seen, has been crowned 'Van of the Year' at the Auto Express Awards 2018: http://bit.ly/2ucfI0j  #BetterConnected pic.twitter.com/UrnqfIic3X";;;#Sprinter #BetterConnected;"1014564311157665805";https://twitter.com/MBVansUK/status/1014564311157665805
;2018/07/04 17:44;7;67;"Motherhood by Sheila Heti is extraordinary. A novel that on one level may be an auto-fictional enquiry into whether to have a child or not, but also asks complicated questions about relationships, fate, history, writing and families. Hugely intelligent, subversive and original. pic.twitter.com/oNJWjzPQq4";;;;"1014550447334576128";https://twitter.com/sineadgleeson/status/1014550447334576128
;2018/07/03 14:30;8;14;"The transition from #Office365 Video to Stream is coming. Stream has some intelligent features, like auto transcript generation. The question is whether tenants will pay extra for those features. Time will tell. https://www.petri.com/office-365-video-transition-steam …pic.twitter.com/ySFJIfHunw";;;#Office365;"1014139408159858688";https://twitter.com/12Knocksinna/status/1014139408159858688
;2018/06/28 02:57;9;14;"Obama deserves credit for averting a depression, saving the auto industry and ramping up renewables and energy independence, which any intelligent person knows. Trump ran casinos to bankruptcy, has little understanding of economics, trade, energy or job market. He’s an idiot.";;;;"1012152985072398336";https://twitter.com/NewPatriotMan/status/1012152985072398336
;2018/04/29 18:35;4;11;"Laying out Intelligent Transportation Society of America's vision for a better world transformed by intelligent mobility at the China Auto Forum in Beijing. Safer. Greener. Smarter. #THISisITShttps://lnkd.in/dwck4tV ";;;#THISisITShttps;"990645661149343744";https://twitter.com/Bhattman_ITSA/status/990645661149343744
;2018/04/24 09:35;17;30;"The DiDi Auto Alliance is an intelligent ride-sharing alliance initiated by DiDi that empowers & redefine smart #Mobility https://www.alliance-2022.com/news/renault-nissan-mitsubishi-joins-didi-chuxing-in-didi-auto-alliance/ …pic.twitter.com/9zXxCjgX6r";;;#Mobility;"988697995108548608";https://twitter.com/Alliance2022/status/988697995108548608
;2018/04/16 09:41;2;13;"Meet the new auto intelligent Speedlight 470EX-AI flash from @CanonRSA. It'll take the fuss out of using a flash and help you light like a pro. https://sie.pm/2HqXCjG  #Speedlight #Flash #Canon #AI - Visual courtesy of @OhGizmo.pic.twitter.com/ogAUnxGqfO";;@CanonRSA @OhGizmo;#Speedlight #Flash #Canon #AI;"985800461595889664";https://twitter.com/JeffSiepman/status/985800461595889664
;2018/03/29 17:43;87;408;"The LN Daemon has a pretty revolutionary component called the Autopilot. Autopilot is a program that auto-buys channel capacity for you on the Blockchain. It’s an autonomous agent working for you, spending your money in intelligent ways. This kind of thing is just getting started";;;;"979398675234353153";https://twitter.com/alexbosworth/status/979398675234353153
;2018/03/28 23:00;42;130;"All-new 2019 Nissan Altima – with Nissan Intelligent Mobility technology, new powertrains and Intelligent All-Wheel Drive – makes world debut at New York International Auto Show. http://nssn.co/suKTpn pic.twitter.com/CBFccepsYa";;;;"979115931233382403";https://twitter.com/NissanUSA/status/979115931233382403
;2018/03/21 01:06;1;10;"To be minorly serious: I'm not sure on how this could be done but less intelligent or knowledgeable people really aren't the problem with our discourse. It's the bad faith and being generally malicious. It would be great if those traits could result in effortless auto-muting.";;;;"976263850466136065";https://twitter.com/ProperOpinion/status/976263850466136065
;2018/03/18 17:47;18;49;"Check out the new Canon Speedlite 470EX-AI, the world’s first flash with Auto Intelligent Bounce. Pre-order today: http://Canon.us/7y58f pic.twitter.com/2tm6DoRNi0";;;;"975428473291390976";https://twitter.com/CanonUSAimaging/status/975428473291390976
;2018/03/17 00:15;16;29;"The compatibility of a SQL Server without the HW & SW maintenance, but with intelligent auto-tuning and security you can only get from machine learning in the cloud. Azure SQL DB Managed Instance - watch here https://youtu.be/W8feSZXm2Ec pic.twitter.com/HwOKU2EZaW";;;;"974801275089862657";https://twitter.com/MSFTMechanics/status/974801275089862657
;2018/03/15 12:20;80;900;"For your convenience, I’ve just activated an auto blocking script on my Twitter account. If you want to get blocked, just reply to my tweets with the keywords BCash or BTrash. My twitter feed is reserved for adults who want to have intelligent debates on merit, not children...";;;;"974259116662251520";https://twitter.com/VinnyLingham/status/974259116662251520
;2018/03/14 14:30;2;4;". @Microsoft showing their growing partner network for @MicrosoftTeams native room systems. They also [sideways] acknowledged how bad their past webcam video was for rooms, saying they 'solved the problems' with @LogitechVC "Intelligent Video" auto shot framing #EC18pic.twitter.com/MSM8nuvYaZ";;@Microsoft @MicrosoftTeams @LogitechVC;#EC18pic;"973929251576668161";https://twitter.com/NJDavidD/status/973929251576668161
;2018/03/04 16:04;28;84;"Watch how the Canon Speedlite 470EX-AI uses its innovative Auto Intelligent Bounce function to set the optimal bounce angle for natural, properly illuminated results indoors.";;;;"970329019274223618";https://twitter.com/CanonUSAimaging/status/970329019274223618
;2018/02/26 14:59;13;58;"World’s First Flash Featuring Auto Intelligent Bounce Technology* Introduced From Canon #PR #News http://Canon.us/ncsjb pic.twitter.com/jsQNjULlbH";;;#PR #News;"968138355723722752";https://twitter.com/CanonUSA/status/968138355723722752
;2018/02/26 06:16;18;16;"#Canon Intros Speedlite 470EX-AI Flash with New Auto Intelligent Bounce Technology https://goo.gl/eBX2p5  https://twitter.com/AI__Newz/status/968004677907382272/photo/1pic.twitter.com/aO0i4rzpNq  #DataScience #MachineLearning #DeepLearning #NLP #Robots #AI #IoT #BigData";;;#Canon #DataScience #MachineLearning #DeepLearning #NLP #Robots #AI #IoT #BigData;"968006783733256192";https://twitter.com/IainLJBrown/status/968006783733256192
;2018/02/22 21:01;23;82;"Ted Cruz: Dems are the party of Lisa Simpson Lisa is the only intelligent character in the family. So R the dumb characters Republican? Remember when Homer joined the NRA and used his semi-auto pistol to change channels on the TV. #lisasimpson #simpsons #tedcruz #resistpic.twitter.com/gOsIc3ABM8";;;#lisasimpson #simpsons #tedcruz #resistpic;"966779886571544576";https://twitter.com/WTFisGoingOnDon/status/966779886571544576
;2018/02/11 09:31;3;17;"#BBNaija. Most swagie, most beautiful, intelligent , clear English, no fake life.. Girls in d house.. I love them anine and auto.. #BBNaija3pic.twitter.com/Rz4PcraKc7";;;#BBNaija #BBNaija3pic;"962620017467682816";https://twitter.com/Rapperanking1/status/962620017467682816
;2018/02/09 02:49;13;12;"Cost difference between Auto Disable & Std Disposable is less than 50 paise! A 2ml Syringe @4.50 Rs MRP costs less than a packet of chips, a bottle of water but every intelligent bureaucrat questions the price difference as if negotiating with Sabziwalla not cost of Unsafe";;@4;;"961794055666585601";https://twitter.com/RojerNath/status/961794055666585601
;2018/02/05 06:17;57;768;"We're showcasing the mighty and intelligent Mercedes-Benz E-Class All-Terrain at Auto Expo 2018. This ensures that there is no ground that we can't conquer. Visit us at Auto Expo from 9th to 14th February to get a closer look. #BestKeepsLeading pic.twitter.com/FiyzYAL7wL";;;#BestKeepsLeading;"960396873256394752";https://twitter.com/MercedesBenzInd/status/960396873256394752
;2018/01/30 08:35;55;630;"In 2017, we launched the long wheel base Mercedes-Benz E-Class, the first “Made in India - for India” car. Visit the upcoming Auto Expo 2018 to witness a spectacle of intelligent luxury cars. #BestKeepsLeading pic.twitter.com/BSiaAF913m";;;#BestKeepsLeading;"958257459457556480";https://twitter.com/MercedesBenzInd/status/958257459457556480
;2018/01/25 23:26;2;12;". @nissan Intelligent Mobility at #NAIAS, imagining a world with zero auto fatalities and zero emissions. #nissanpic.twitter.com/GYI8M420eL";;@nissan;#NAIAS #nissanpic;"956669536954191872";https://twitter.com/NAIASDetroit/status/956669536954191872
